,Unnamed: 0,Unnamed: 0.1,Unnamed: 0.1.1,image,name,author,format,book_depository_stars,price,currency,old_price,isbn,category,img_paths,description
489,489,489,489,https://d1w7fb2mkkr3kw.cloudfront.net/assets/images/book/mid/9781/9413/9781941325117.jpg,Adult Coloring Book: Stress Relieving Animal Designs,Adult Coloring Book Artists,Paperback,4.0,14.94,$,,9781941325117,Art-Photography,dataset/Art-Photography/0000490.jpg,"24 completely unique unicorn coloring pages for kids ages 4-8!Unicorns are so much fun to color because they lead such interesting, magical lives! They meet princesses, dragons and mermaids. They visit castles and enchanted woodlands, fly through stars and rainbow skies and even wind up in the Land of Sweets! Share the fun and magic of unicorns with a special child! This coloring book is a great non-screen activity to stimulate a child's creativity and imagination. It makes a perfect gift!About this unicorn coloring book:* Contains 34 completely unique coloring pages. There are NO duplicate images in this book.* The pages are single-sided to prevent bleed-through, and so that pages can be removed and displayed without losing an image on the back.* We have carefully designed each page to be entertaining and suitable for children in the 4 to 8 year-old age range. We have avoided overly-intricate designs as well as overly-simplistic ones. We believe children of this age love coloring fun scenes that fire up their imaginations, not a book full of simple shapes.* The pages are a nice, large 8.5x11 size.Magic Unicorns Coloring Book"
490,490,490,490,https://d1w7fb2mkkr3kw.cloudfront.net/assets/images/book/mid/9781/4722/9781472257857.jpg,Try This At Home,Frank Turner,Hardback,4.5,13.96,$,24.0,9781472257857,Art-Photography,dataset/Art-Photography/0000491.jpg,"In every sport, in every country around the world, there are fans on the losing side who know that something other than skill and luck beat their favorite team or player. Sometimes they’re actually right. That’s why sports lovers will devour this inside look at the 25 biggest myths and scandals in professional and collegiate athletics.Elliott Kalb examines each potential outrage in detail, supporting and debunking popular beliefs along the way. In some cases, proof does exist that the ?fix” was in?like the 1919 World Series thrown by the Chicago ?Black” Sox players or the conspiracy to keep African Americans out of Major League Baseball until 1947. In others, there remain only whispers of wrongdoing and suspicious circumstances, including the Jets’ win in Super Bowl III and Muhammad Ali’s first-round knockout of Sonny Liston. This is sure to capture the imagination of anyone who has ever wondered what really happened behind the scenes."
491,491,491,491,https://d1w7fb2mkkr3kw.cloudfront.net/assets/images/book/mid/9781/7806/9781780672335.jpg,Fabric for Fashion:The Swatch Book,Clive Hallett,Hardback,4.5,64.34,$,78.0,9781780672335,Art-Photography,dataset/Art-Photography/0000492.jpg,"This easily navigable resource provides over 125 swatches of the most recognized and widely used varieties of fabric, including natural fabrics such as cottons, silks, wools, and linens as well as artificial and synthetic fabrics like acetates, lyocells, nylons, and metallics to encourage consideration of not just the aesthetic appeal of various fabrics but also their structure, feel, and weight. Bound into a hardcover book, with descriptions and contextual illustrations alongside them, the fabrics are in their raw state, before bleaching, dying, or finishing, so that their properties can be observed without the distraction of color or pattern. With information on fibers, basic construction of fabrics, weights, construction, and weave comparison, the book will help student fashion designers to make informed textile choices based upon an understanding of raw materials together with the processes that make up a fabric. A useful glossary defines key terminology. The book will be useful for anyone who works with fabrics and is the ideal companion to the Fabric for Fashion book."
492,492,492,492,https://d1w7fb2mkkr3kw.cloudfront.net/assets/images/book/mid/9780/2412/9780241207048.jpg,Spring,Ali Smith,Hardback,4.5,14.01,$,21.1,9780241207048,Art-Photography,dataset/Art-Photography/0000493.jpg,
493,493,493,493,https://d1w7fb2mkkr3kw.cloudfront.net/assets/images/book/mid/9780/5715/9780571533022.jpg,Improve your sight-reading! Piano Grade 2,Paul Harris,Paperback,4.5,8.31,$,8.8,9780571533022,Art-Photography,dataset/Art-Photography/0000494.jpg,"The full eBook version of Improve Your Sight-Reading! Grade 2 in fixed-layout format - part of the best-selling series by Paul Harris guaranteed to improve your sight-reading! This workbook helps the player overcome problems, by building up a complete picture of each piece, through rhythmic and melodic exercises related to specific technical issues, then by studying prepared pieces with associated questions, and finally going solo with a series of meticulously-graded sight-reading pieces. This edition has been completely re-written, with exercises and pieces to support the Associated Board's sight-reading requirements from 2009. Improve Your Sight-Reading! will help you improve your reading ability, and with numerous practice tests included, will ensure sight-reading success in graded exams."
494,494,494,494,https://d1w7fb2mkkr3kw.cloudfront.net/assets/images/book/mid/9781/7850/9781785034107.jpg,"Unfiltered: No Shame, No Regrets, Just Me",Lily Collins,Hardback,4.0,14.47,$,16.0,9781785034107,Art-Photography,dataset/Art-Photography/0000495.jpg,"International bestseller! In her groundbreaking debut essay collection, actress Lily Collins—Golden Globe-nominated star of Rules Don’t Apply, Mortal Instruments, and To the Bone—is opening a poignant, honest conversation about the things young women struggle with: body image, self-confidence, relationships, family, dating, and so much more. Lily shares her life and her own deepest secrets, underlining that every single one of us experiences pain and heartbreak. We all understand what it’s like to live in the light and in the dark. For Lily, it’s about making it through to the other side, where you love what you see in the mirror and where you embrace yourself just as you are. She's learned that all it takes is one person standing up and saying something for everyone else to realize they’re not alone. By turns hilarious and heartbreaking, Lily’s honest voice will inspire you to be who you are and say what you feel. It’s time to claim your voice! It’s time to live your life unfiltered."
495,495,495,495,https://d1w7fb2mkkr3kw.cloudfront.net/assets/images/book/mid/9780/8230/9780823099207.jpg,Colored Pencil Painting Bible,Alyona Nickelsen,Paperback,4.5,16.02,$,24.0,9780823099207,Art-Photography,dataset/Art-Photography/0000496.jpg,"Learn to paint with groundbreaking new techniques for a favorite medium! • Dazzling colors, incredible realism—with simple step-by-step demonstrations • Easy-to-follow instructions from a top colored-pencil artist • Master the wide range of colored pencil effects possible, including blending, layering, translucent effects, and more Radiant color…painterly finishes…astonishing realism…with colored pencils! Achieve rich, luminous color and eye-popping ultra-realistic effects. Artists of every level will be inspired by the amazing new techniques created by Alyona Nickelsen, presented in Colored Pencil Painting Bible for the very first time. Nickelsen’s innovations will delight readers and detailed you-can-do-it processes bring her striking results within reach for every artist. Take colored pencils beyond the ordinary with Colored Pencil Painting Bible!"
496,496,496,496,https://d1w7fb2mkkr3kw.cloudfront.net/assets/images/book/mid/9780/3162/9780316227704.jpg,Underwater Dogs,Seth Casteel,Hardback,4.5,16.99,$,17.99,9780316227704,Art-Photography,dataset/Art-Photography/0000497.jpg,"The exuberant, exhilarating photographs of dogs underwater that have become a sensation From the water's surface, it's a simple exercise: a dog's leap, a splash, and then a wet head surfacing with a ball, triumphant. But beneath the water is a chaotic ballet of bared teeth and bubbles, paddling paws, fur and ears billowing in the currents. From leaping Lab to diving Dachshund, the water is where a dog's distinct personality shines through; some lounge in the current, paddling slowly, but others arch their bodies to cut through the water with the focus and determination of a shark. In more than eighty portraits, award-winning pet photographer and animal rights activist Seth Casteel captures new sides of our old friends with vibrant underwater photography that makes it impossible to look away. Each image bubbles with exuberance and life, a striking reminder that even in the most loveable and domesticated dog, there are more primal forces at work. In Underwater Dogs, Seth Casteel gives playful and energetic testament to the rough-and-tumble joy that our dogs bring into our lives."
497,497,497,497,https://d1w7fb2mkkr3kw.cloudfront.net/assets/images/book/mid/9780/7935/9780793525676.jpg,Carl Czerny,Carl Czerny,Paperback,4.0,7.43,$,9.0,9780793525676,Art-Photography,dataset/Art-Photography/0000498.jpg,
498,498,498,498,https://d1w7fb2mkkr3kw.cloudfront.net/assets/images/book/mid/9781/4052/9781405206235.jpg,Red Rackham's Treasure,Herge,Paperback,4.5,8.41,$,10.3,9781405206235,Art-Photography,dataset/Art-Photography/0000499.jpg,"Herg�'s classic comic book creation Tintin is one of the most iconic characters in children's books. These highly collectible editions of the original 24 adventures will delight Tintin fans old and new. Perfect for lovers of graphic novels, mysteries and historical adventures. The world's most famous travelling reporter sets out in search of Red Rackham's treasure. Determined to find the treasure of the notorious pirate Red Rackham, Tintin and Captain Haddock set sail aboard the Sirius to find the shipwreck of the Unicorn. With the help of an ingenious shark-shaped submarine, Tintin follows the clues deep down on this ocean adventure. The Adventures of Tintin are among the best books for readers aged 8 and up. Herg� (Georges Remi) was born in Brussels in 1907. Over the course of 54 years he completed over 20 titles in The Adventures of Tintin series, which is now considered to be one of the greatest, if not the greatest, comics series of all time. Have you collected all 24 graphic novel adventures? Tintin in the Land of the Soviets Tintin in the Congo Tintin in America Tintin: Cigars of the Pharaoh Tintin: The Blue Lotus Tintin: The Broken Ear Tintin: The Black Island Tintin: King Ottakar's Sceptre Tintin: The Crab with the Golden Claws Tintin: The Shooting Star Tintin: The Secret of the Unicorn Tintin: Red Rackham's Treasure Tintin: The Seven Crystal Balls Tintin: Prisoners of the Sun Tintin: Land of Black Gold Tintin: Destination Moon Tintin: Explorers of the Moon Tintin: The Calculus Affair Tintin: The Red Sea Sharks Tintin in Tibet Tintin: The Castafiore Emerald Tintin: Flight 714 to Sydney The Adventures of Tintin and the Picaros Tintin and Alph-Art"
499,499,499,499,https://d1w7fb2mkkr3kw.cloudfront.net/assets/images/book/mid/9781/4019/9781401915360.jpg,"Change Your Thoughts, Change Your Life",Dr. Wayne W. Dyer,Paperback,4.5,14.41,$,17.0,9781401915360,Art-Photography,dataset/Art-Photography/0000500.jpg,"Five hundred years before the birth of Jesus, a God-realized being named Lao-tzu in ancient China dictated 81 verses, which are regarded by many as the ultimate commentary on the nature of our existence. The classic text of these 81 verses, called the Tao Te Ching or the Great Way, offers advice and guidance that is balanced, moral, spiritual, and always concerned with working for the good. In this book, Dr. Wayne W. Dyer has reviewed hundreds of translations of the Tao Te Ching and has written 81 distinct essays on how to apply the ancient wisdom of Lao-tzu to today’s modern world. This work contains the entire 81 verses of the Tao, compiled from Wayne’s researching of 12 of the most well-respected translations of text that have survived for more than 25 centuries. Each chapter is designed for actually living the Tao or the Great Way today. Some of the chapter titles are “Living with Flexibility,” “Living Without Enemies,” and “Living by Letting Go.” Each of the 81 brief chapters focuses on living the Tao and concludes with a section called “Doing the Tao Now.” Wayne spent one entire year reading, researching, and meditating on Lao-tzu’s messages, practicing them each day and ultimately writing down these essays as he felt Lao-tzu wanted you to know them. This is a work to be read slowly, one essay a day. As Wayne says, “This is a book that will forever change the way you look at your life, and the result will be that you’ll live in a new world aligned with nature. Writing this book changed me forever, too. I now live in accord with the natural world and feel the greatest sense of peace I’ve ever experienced. I’m so proud to present this interpretation of the Tao Te Ching, and offer the same opportunity for change that it has brought me.”"
500,500,500,500,https://d1w7fb2mkkr3kw.cloudfront.net/assets/images/book/mid/9783/8995/9783899555608.jpg,The Monocle Guide to Cosy Homes,Monocle,Hardback,4.0,38.10,$,44.0,9783899555608,Art-Photography,dataset/Art-Photography/0000501.jpg,"A handbook for making a home that will stand the test of time; take knocks and scuffs in its stride; and where lives can unfold, children grow up, and dogs run wild."
501,501,501,501,https://d1w7fb2mkkr3kw.cloudfront.net/assets/images/book/mid/9781/7809/9781780992266.jpg,Ghosts of My Life,Mark Fisher,Paperback,4.0,13.09,$,16.0,9781780992266,Art-Photography,dataset/Art-Photography/0000502.jpg,"This collection of writings by Mark Fisher, author of acclaimed Capitalist Realism, argues that we are haunted by futures that failed to happen. Fisher searches for the traces of these lost futures in the work of David Peace, John Le Carré, Christopher Nolan, Joy Division, Burial and many others. THIS BRAND NEW EDITION FEATURES A NEW INTRODUCTION BY MATT COLQUHOUN AND NEW AFTERWORD BY SIMON REYNOLDS."
502,502,502,502,https://d1w7fb2mkkr3kw.cloudfront.net/assets/images/book/mid/9781/8497/9781849756136.jpg,Monochrome Home,Hilary Robertson,Hardback,3.5,23.14,$,31.4,9781849756136,Art-Photography,dataset/Art-Photography/0000503.jpg,"Decorating in black and white is perennially popular and eternally chic. Hilary Robertson demonstrates how, whether used alone or together, these contrasting shades can create dramatic effects at home, from the classic to the eclectic."
503,503,503,503,https://d1w7fb2mkkr3kw.cloudfront.net/assets/images/book/mid/9781/4521/9781452128269.jpg,Art Inc.,Lisa Congdon,Paperback,4.0,11.40,$,15.0,9781452128269,Art-Photography,dataset/Art-Photography/0000504.jpg,"Includes Part 1A: Books, Part 1B: Pamphlets, Serials and Contributions to Periodicals and Part 2: Periodicals. (Part 2: Periodicals incorporates Part 2, Volume 41, 1946, New Series)"
504,504,504,504,https://d1w7fb2mkkr3kw.cloudfront.net/assets/images/book/mid/9780/5710/9780571081820.jpg,Rosencrantz and Guildenstern Are Dead,Tom Stoppard,Paperback,4.0,9.33,$,12.4,9780571081820,Art-Photography,dataset/Art-Photography/0000505.jpg,"Originally published: New York: Grove Press, 1967."
505,505,505,505,https://d1w7fb2mkkr3kw.cloudfront.net/assets/images/book/mid/9781/4521/9781452107509.jpg,Botanicals Labels and Stickers,Rifle Paper Co.,Calendar,5.0,7.96,$,11.5,9781452107509,Art-Photography,dataset/Art-Photography/0000506.jpg,
506,506,506,506,https://d1w7fb2mkkr3kw.cloudfront.net/assets/images/book/mid/9781/7856/9781785653636.jpg,The Art of Horizon,Paul Davies,Hardback,4.5,22.57,$,37.1,9781785653636,Art-Photography,dataset/Art-Photography/0000507.jpg,"Do you every wonder where your pets go when you let them out to play? Find out with your host, Felicia Feline. Join Felicia and her friends on the adventure of a lifetime. A first chapter book for ages 6 and up."
507,507,507,507,https://d1w7fb2mkkr3kw.cloudfront.net/assets/images/book/mid/9780/2856/9780285636644.jpg,New Drawing on the Right Side of the Brain Workbook,Betty Edwards,Paperback,4.0,16.56,$,20.1,9780285636644,Art-Photography,dataset/Art-Photography/0000508.jpg,"""Translated into thirteen languages, with more than 2.5 million copies sold, Drawing on the Right Side of the Brain is the world's most widely used drawing instruction book.""--BOOK JACKET. ""This twentieth-anniversary edition of Drawing on the Right Side of the Brain has been dramatically revised, with more than fifty percent new material, including: recent developments in brain research that relate to drawing; new insights on the use of drawing techniques in the corporate world and in education; instruction on self-expression through drawing; ways to step beyond black-and-white drawing into color; and detailed advice on applying the five basic skills of drawing to solve problems.""--BOOK JACKET."
508,508,508,508,https://d1w7fb2mkkr3kw.cloudfront.net/assets/images/book/mid/9780/7434/9780743478649.jpg,Chronicles Volume 1,Bob Dylan,Paperback,4.0,9.79,$,12.9,9780743478649,Art-Photography,dataset/Art-Photography/0000509.jpg,
509,509,509,509,https://d1w7fb2mkkr3kw.cloudfront.net/assets/images/book/mid/9781/4013/9781401310646.jpg,Pawnee,Leslie Knope,Paperback,4.0,15.63,$,24.0,9781401310646,Art-Photography,dataset/Art-Photography/0000510.jpg,"No assessment of the Plains Indians can be complete without some account of the Pawnees. They ranged from Nebraska to Mexico and, when not fighting among themselves, fought with almost every other Plains tribe at one time or another. Regarded as ""aliens"" by many other tribes, the Pawnees were distinctively different from most of their friends and enemies. George Hyde spent more than thirty years collecting materials for his history of the Pawnees. The story is both a rewarding and a painful one. The Pawnee culture was rich in social and religious development. But the Pawnees' highly developed political and religious organization was not a source of power in war, and their permanent villages and high standard of living made them inviting and 'fixed targets for their enemies. They fought and sometimes defeated larger tribes, even the Cheyennes and Sioux, and in one important battle sent an attacking party of Cheyennes home in humiliation after seizing the Cheyennes' sacred arrows. While many Pawnee heroes died fighting off enemy attacks on Loup Fork, still more died of smallpox, of neglect at the hands of the government, and of errors in the policies of Quaker agents. In many ways The Pawnee Indians is the best synthesis Hyde ever wrote. It looks far back into tribal history, assessing Pawnee oral history against anthropological evidence and examining military patterns and cultural characteristics. Hyde tells the story of the Pawnees objectively, reinforcing it with firsthand accounts gleaned from many sources, both Indian and white."
510,510,510,510,https://d1w7fb2mkkr3kw.cloudfront.net/assets/images/book/mid/9781/6176/9781617691515.jpg,"New Bohemians, The:Cool and Collected Homes",Justina Blakeney,Hardback,4.0,21.96,$,34.5,9781617691515,Art-Photography,dataset/Art-Photography/0000511.jpg,"A New York Times bestseller. “With pages of tips and twelve DIY projects, the book makes the free-spirited style easy to achieve.” —Architectural Digest In The New Bohemians, LA-based designer Justina Blakeney defines the New Bohemians as creative individuals who are boutique owners and bloggers, entrepreneurs and ex-pats, artists and urban farmers. They embrace free-spirited, no-rules lifestyles and apply that attitude to all areas of their existence, including their homes. With little distinction between work and play, the new boho home often includes an office, art gallery, showroom, photography studio, restaurant, or even a pop-up shop. The New Bohemians explores 20 homes located primarily on the East and West coasts. Exclusive interviews with the owners, 12 DIY projects created by Blakeney and inspired by objects found in the homes, and a “Plant-O-Pedia” offer insight into achieving this aesthetic. In addition, each home is accompanied by an Adopt-an-Idea section that offers general decor, styling, and shopping tips for easy duplication in your own home. “The New Bohemians is sure to inspire readers to create, to reuse, to grow, to let loose, and to invite some cool and collected energy into their own homes.” —California Home+Design “A colorful and endlessly inspiring cover-to-cover read . . . From the dreamy homes of twenty stylesetters across the country to easy DIY projects, The New Bohemians is our new favorite coffee table book for home inspiration.” —One Kings Lane “Fans of Justina’s style will be glad to see [the book] reads like a how-to for finding one’s own inner bohemian . . . the book is as functional as it is gorgeous.” —Apartment Therapy"
511,511,511,511,https://d1w7fb2mkkr3kw.cloudfront.net/assets/images/book/mid/9780/0082/9780008204600.jpg,The Case of Beasts: Explore the Film Wizardry of Fantastic Beasts and Where to Find Them,Mark Salisbury,Hardback,4.5,30.52,$,37.1,9780008204600,Art-Photography,dataset/Art-Photography/0000512.jpg,"""The Case of Beasts delivers an enchanting interactive experience by sharing filmmaking secrets, film photography and artwork, and behind-the-scenes stories from cast and crew. Full of removable, facsimile reproductions of props and paper ephemera from the movie, along with some very special effects, this collectible volume offers a unique look from the talented group who created this movie magic.""--"
512,512,512,512,https://d1w7fb2mkkr3kw.cloudfront.net/assets/images/book/mid/9780/7390/9780739019689.jpg,"Alfred's Basic Piano Prep Course Theory Book, Bk a",Willard Palmer,Paperback,0.0,6.64,$,7.0,9780739019689,Art-Photography,dataset/Art-Photography/0000513.jpg,"Designed to coordinate page-by-page with the Lesson Books, each Theory Book contains enjoyable games and quizzes that reinforce the principles presented in the Lesson Books. Students can increase their musical understanding while they are away from the keyboard."
513,513,513,513,https://d1w7fb2mkkr3kw.cloudfront.net/assets/images/book/mid/9780/0995/9780099535478.jpg,Cradle to Cradle,Michael Braungart,Paperback,4.0,9.34,$,11.4,9780099535478,Art-Photography,dataset/Art-Photography/0000514.jpg,"A manifesto for a radically different philosophy and practice of manufacture and environmentalism ""Reduce, reuse, recycle"" urge environmentalists; in other words, do more with less in order to minimize damage. But as this provocative, visionary book argues, this approach perpetuates a one-way, ""cradle to grave"" manufacturing model that dates to the Industrial Revolution and casts off as much as 90 percent of the materials it uses as waste, much of it toxic. Why not challenge the notion that human industry must inevitably damage the natural world? In fact, why not take nature itself as our model? A tree produces thousands of blossoms in order to create another tree, yet we do not consider its abundance wasteful but safe, beautiful, and highly effective; hence, ""waste equals food"" is the first principle the book sets forth. Products might be designed so that, after their useful life, they provide nourishment for something new-either as ""biological nutrients"" that safely re-enter the environment or as ""technical nutrients"" that circulate within closed-loop industrial cycles, without being ""downcycled"" into low-grade uses (as most ""recyclables"" now are). Elaborating their principles from experience (re)designing everything from carpeting to corporate campuses, William McDonough and Michael Braungart make an exciting and viable case for change."
514,514,514,514,https://d1w7fb2mkkr3kw.cloudfront.net/assets/images/book/mid/9781/9334/9781933492735.jpg,How to Draw,Scott Robertson,Paperback,4.5,31.14,$,41.0,9781933492735,Art-Photography,dataset/Art-Photography/0000515.jpg,"Learn to draw charming characters! Filled with colorful illustrations and step-by-step explanations, How to Draw a Character is the perfect introduction to the art of sketching people. From babies to grandmothers, cyclists to shoppers, How to Draw a Character gives readers the skills to draw any kind of character in any setting. The easy tutorials break down seemingly complicated drawings into simple components, so even beginners will soon be drawing confidently. The book begins with a handful of simple anatomical rules that lend life and realism to the drawings. It goes on to explore all the essential aspects of figure drawing, from capturing emotions to drawing your characters in motion. Equal parts inspiration and tutorial, the charming drawings are sure to spark the imagination. Soizic Mouton's How to Draw a Character will give anyone who’s ever wanted to learn to draw the confidence to pick up a pencil and begin!"
515,515,515,515,https://d1w7fb2mkkr3kw.cloudfront.net/assets/images/book/mid/9781/6167/9781616770761.jpg,Piano Adventures - Theory Book - Primer Level,Nancy Faber,Paperback,4.5,6.55,$,8.0,9781616770761,Art-Photography,dataset/Art-Photography/0000516.jpg,"Piano Adventures Theory Book, Primer Level is divided into 10 units, correlating with the 10 units of the Lesson Book. Each unit reinforces basic theory concepts through writing, sightreading, and ear-training activities - all within a youthful context."
