,Unnamed: 0,Unnamed: 0.1,Unnamed: 0.1.1,image,name,author,format,book_depository_stars,price,currency,old_price,isbn,category,img_paths,description
266,266,266,266,https://d1w7fb2mkkr3kw.cloudfront.net/assets/images/book/mid/9780/7535/9780753545683.jpg,Shit Happens!,James Alexander,Paperback,4.0,9.32,$,11.4,9780753545683,Art-Photography,dataset/Art-Photography/0000267.jpg,"Good advice for tough times ""To succeed in life, you need three things: a wishbone, a backbone and a funny bone."" —Reba McEntire ""You can't be brave if you've only had wonderful things happen to you."" —Mary Tyler Moore ""Sometimes you just have to pee in the sink."" —Charles Bukowski ""Don't go around saying the world owes you a living. The world owes you nothing. It was here first."" —Mark Twain ""Anyone who trades liberty for security deserves neither."" —Benjamin Franklin ""When your dreams turn to dust, vacuum."" —Desmond Tutu Ever had one of those days when nothing seems to go your way? Poor little you. Now deal with it! Life is too short to spend moping around when instead you could be taking things with a pinch of salt—and a shot of tequila. Here's a book packed with straight-talking quotations to help you get a grip and find the brighter side."
267,267,267,267,https://d1w7fb2mkkr3kw.cloudfront.net/assets/images/book/mid/9781/6167/9781616776206.jpg,My First Piano Adventure For The Young Beginner - Writing Book A - Pre-Reading,Nancy Faber,Paperback,4.0,6.85,$,7.0,9781616776206,Art-Photography,dataset/Art-Photography/0000268.jpg,"(Faber Piano Adventures ). Written for ages 5 and 6, My First Piano Adventure captures the child's playful spirit. Fun-filled songs, rhythm games and technique activities develop beginning keyboard skills. Three distinguishing features of the Lesson Book A make it unique and effective for the young 5-6 year old beginner. 1. A strong focus on technique embedded in the book through playful technique games, chants, and carefully-composed pieces that gently lead the child into pianistic motions. 2. An outstanding CD for the young student to listen, sing, tap, and play along with at the piano. The orchestrated songs on the CD feature children singing the lyrics, which has great appeal to the 5-6 year old beginner. The CD becomes a ready-made practice partner that guides the student and parent for all the pieces and activities in the books. 3. The fanciful art features five multi-cultural children who are also learning to play. These friends at the piano introduce basic rhythms, white key names, and a variety of white and black-key songs that span classical, folk, and blues. Young students will listen, sing, create, and play more musically with Nancy and Randall Faber s My First Piano Adventure, Lesson Book A. The Lesson Book introduces directional pre-reading, elementary music theory and technique with engaging songs, games, and creative discovery at the keyboard. Young students will enjoy the multi-cultural ""friends at the piano"" who introduce white-key names, basic rhythms, and a variety of songs which span classical, folk, and blues. Ear-training and eye-training are also part of the curriculum. The Fabers' instructional theory ""ACE"" - Analysis, Creativity, and Expression, guides the pedagogy of My First Piano Adventure. Analysis leads to understanding, creativity leads to self-discovery, and expression develops personal artistry. The CD for this book offers a unique listening experience with outstanding orchestrations and vocals. The recordings demonstrate a key principle of the course: when children listen, sing, tap, and move to their piano music, they play more musically. View Helpful Introductory Videos Here"
268,268,268,268,https://d1w7fb2mkkr3kw.cloudfront.net/assets/images/book/mid/9780/1419/9780141978109.jpg,Into The Woods,John Yorke,Paperback,4.0,9.80,$,12.4,9780141978109,Art-Photography,dataset/Art-Photography/0000269.jpg,"‘The Woods are just Trees. The Trees are just Wood.’ – All together In 1987, Stephen Sondheim and James Lapine combined several classic fairy tales including Little Red Riding Hood, Cinderella, and Jack and the Beanstalk to create Into the Woods. Funny and heartfelt, this musical explores what it might mean to act responsibly in society, both as a parent and as a child. Situating the work within Sondheim’s oeuvre and the Broadway canon, Olaf Jubin first offers a detailed reading of the show itself, before discussing key productions in New York and London, and 2014’s Oscar-nominated screen adaptation. The radically different approaches to staging Into the Woods are testament to how open the musical is to re-interpretation for new audiences. A combination of critical explication with performance and film analysis, as well as an overview of popular and critical reception, this book is meant for anyone who has enjoyed Into the Woods, be it as a musical theatre fan, an enchanted audience member, a student or a dedicated theatre professional."
269,269,269,269,https://d1w7fb2mkkr3kw.cloudfront.net/assets/images/book/mid/9781/5958/9781595829412.jpg,Avatar: The Last Airbender# The Promise Part 3,Gene Luen Yang,Paperback,4.5,9.37,$,11.5,9781595829412,Art-Photography,dataset/Art-Photography/0000270.jpg,"#1 New York Times graphic novel bestseller! Avatar Aang and friends honor an Air Nomad holiday that hasn't been celebrated in over one hundred years. But when cryptic visits from the spirit of Avatar Yangchen lead Aang to a refinery operating on land sacred to the Airbenders--they soon find themselves in peril as a dangerously powerful ancient spirit awakens with vengeance and destruction on its mind! This omnibus collects The Rift parts 1-3, continuing the long-running official continuation of the hit Nickelodeon animated series Avatar: The Last Airbender!"
270,270,270,270,https://d1w7fb2mkkr3kw.cloudfront.net/assets/images/book/mid/9780/7535/9780753545676.jpg,Memos to Shitty People: A Delightful & Vulgar Adult Coloring Book,James Alexander,Paperback,4.5,8.63,$,10.3,9780753545676,Art-Photography,dataset/Art-Photography/0000271.jpg,"A Stress-Relieving Hilarious Coloring Book * Do you have a terrible, incompetent neighbor? * Does your annoying coworker never shut up? * Do you have to deal with shitty people every day? * Are you trying to find an unique novelty gift for your best friend? Sometimes, you just need to SWEAR at someone... Join the foulmouthed masses and unwind with Memos to Shitty People, an adult coloring book. Color designs featuring humorous and delightfully vulgar phrases like ""Seriously, Bitch?"" and ""Oh look... the fuck-up fairy has visited!"". Each page is replete with cute innocent animals, hidden critters, beautiful flowers and foliage... color away while letting the steam out. Enjoy mindfulness and relaxation with this brilliant anti-stress therapy, also the perfect gag-gift! This beautiful coloring book features: * More Than 30 Delightful Phrases to Color * Beautiful Designs with Intricate Details * Hidden Critters to Find Amongst the Leaves! * Single-Sided Pages at 8.5 x 11"" * Includes Digital PDF Bonus Inside the Book Order now and get started. Your inner peace is waiting, and it has some choice words for you. TAGS: adult coloring books, adult coloring book, coloring books for grown-ups, coloring books for adults, coloring book for adults, adult coloring books swear words, adult coloring books best sellers, adult coloring books stress relieving patterns, adult coloring books for women, adult coloring books for men, adult coloring books animals, adult coloring books dogs, adult coloring books cats, adult coloring books flowers, leafy animals coloring book, leafy animals james alexander"
271,271,271,271,https://d1w7fb2mkkr3kw.cloudfront.net/assets/images/book/mid/9780/2413/9780241339121.jpg,Create Dangerously,Albert Camus,Paperback,4.0,2.81,$,,9780241339121,Art-Photography,dataset/Art-Photography/0000272.jpg,"A New York Times Notable Book A Miami Herald Best Book of the Year In this deeply personal book, the celebrated Haitian-American writer Edwidge Danticat reflects on art and exile. Inspired by Albert Camus and adapted from her own lectures for Princeton University’s Toni Morrison Lecture Series, here Danticat tells stories of artists who create despite (or because of) the horrors that drove them from their homelands. Combining memoir and essay, these moving and eloquent pieces examine what it means to be an artist from a country in crisis. BONUS MATERIAL: This edition includes an excerpt from Edwidge Danticat's Claire of the Sea Light."
272,272,272,272,https://d1w7fb2mkkr3kw.cloudfront.net/assets/images/book/mid/9781/9087/9781908707321.jpg,Really Relaxing Colouring Book 2,Elizabeth James,Paperback,4.0,8.28,$,,9781908707321,Art-Photography,dataset/Art-Photography/0000273.jpg,"Really RELAXING Colouring Book 6: Indian Summer - A Jewelled Journey through Indian Pattern and Colour is a beautiful and relaxing creative colouring book for all ages ! Switch off, unwind, and unleash your inner creativity as you lose yourself in the flow of colouring in these stunning patterns and designs. Each of these beautiful individual designs are printed on a single page with the reverse left blank - so no bleed through, and perfect whether you use pencils, pens or paints. Collect the whole ' Really Relaxing Colouring Book' series, or try our unique ' Cool Colouring Books' Collection too!"
273,273,273,273,https://d1w7fb2mkkr3kw.cloudfront.net/assets/images/book/mid/9781/8461/9781846148507.jpg,The Fox and the Star,Coralie Bickford-Smith,Hardback,4.0,16.12,$,20.1,9781846148507,Art-Photography,dataset/Art-Photography/0000274.jpg,"From the award-winning designer of the iconic Penguin Hardcover Classics comes a beautifully illustrated fable about loss, friendship, and courage The Fox and the Star is the story of a friendship between a lonely Fox and the Star who guides him through the frightfully dark forest. Illuminated by Star’s rays, Fox forages for food, runs with the rabbits, and dances in the rain—until Star suddenly goes out and life changes, leaving Fox huddling for warmth in the unfamiliar dark. To find his missing Star, Fox must embark on a wondrous journey beyond the world he knows—a journey lit by courage, newfound friends, and just maybe, a star-filled new sky. Inspired by the Arts and Crafts movement and the art of William Blake, The Fox and the Star is a heartwarming, hopeful tale which comes alive through Bickford-Smith’s beloved illustrations, guiding readers both young and grown to “look up beyond your ears.”"
274,274,274,274,https://d1w7fb2mkkr3kw.cloudfront.net/assets/images/book/mid/9780/0072/9780007202157.jpg,10-minute Watercolours,Hazel Soan,Paperback,4.0,5.49,$,7.8,9780007202157,Art-Photography,dataset/Art-Photography/0000275.jpg,"This handy, practical and inspirational little book is perfect for the pocket or art bag. It shows watercolour painters of all levels how to loosen up their paintings and maintain spontaneity by painting simple watercolour studies in no more than 10 minutes."
275,275,275,275,https://d1w7fb2mkkr3kw.cloudfront.net/assets/images/book/mid/9781/7809/9781780938431.jpg,An Actor Prepares,Constantin Stanislavski,Paperback,4.0,13.39,$,13.9,9781780938431,Art-Photography,dataset/Art-Photography/0000276.jpg,"A practical and theoretical guide to the world of the professional actor, skilfully combining ideas from a range of practitioners and linking the academy to the industry. It covers key areas such as: the development of modern drama and acting processes over the years the approach and legacy of acting pioneers and practitioners from around the world acting techniques and practicalities, including training, auditioning, rehearsing and performing – both for stage and camera Complete with a glossary of terms and useful website suggestions, this is the ideal introduction for anyone wanting to learn more about the practice of acting and the people who have advanced its evolution."
276,276,276,276,https://d1w7fb2mkkr3kw.cloudfront.net/assets/images/book/mid/9780/5715/9780571532001.jpg,Me and My Piano Part 1,Fanny Waterman,Paperback,4.0,7.75,$,8.3,9780571532001,Art-Photography,dataset/Art-Photography/0000277.jpg,"Me And My Piano Part 1 takes the young pianist step-by-step through the early stages of piano technique, first with separate hands, then with a sequence of very easy pieces for hands together. All use a constant five finger hand position in the key of C major. Games and puzzles give elementary theory a new lease of life, and children will love the rhymes and songs introducing characters such the Ostrich, Sammy Squirrel and the Old Man with the Beard! Fanny Waterman and Marion Harewood's Me And My Piano series is probably the UK's most widely-used and biggest selling piano method. It is now published in a new edition including a new larger size, improved layout making it easier to read, a clean new look with new typesetting and music-setting and the instantly recognisable cover designs have been updated for extra vibrancy. Enchantingly illustrated, in full-colour throughout, this essential and irresistible book will encourage the young pianist to expand his or her learning in the most enjoyable way. This is the full eBook edition in fixed-layout format."
277,277,277,277,https://d1w7fb2mkkr3kw.cloudfront.net/assets/images/book/mid/9781/7850/9781785036804.jpg,Secrets for the Mad,dodie,Hardback,4.5,17.40,$,21.1,9781785036804,Art-Photography,dataset/Art-Photography/0000278.jpg,"Originally published: Great Britain: Ebury, 2017."
278,278,278,278,https://d1w7fb2mkkr3kw.cloudfront.net/assets/images/book/mid/9781/4447/9781444733693.jpg,Bohemian Rhapsody,Lesley-Ann Jones,Paperback,4.0,9.47,$,12.4,9781444733693,Art-Photography,dataset/Art-Photography/0000279.jpg,"""First published in the UK in 2018 by Carlton Books Limited""--Page facing title page."
279,279,279,279,https://d1w7fb2mkkr3kw.cloudfront.net/assets/images/book/mid/9780/7148/9780714865911.jpg,Art as Therapy,Alain de Botton,Hardback,4.0,32.10,$,36.0,9780714865911,Art-Photography,dataset/Art-Photography/0000280.jpg,"Group Art Therapy: Practice and Research is the first textbook of its kind, taking into account practice-based evidence and using a transtheoretical approach to present a range of art therapy group interventions. The book covers essential topics including leadership, art making, successful therapeutic factors, and the basic stages of developing and facilitating groups. Offering practical information not only to students but also to experienced practitioners, the chapters provide details about preparation and practice, note-taking and documentation, and research tips. Adhering to the most up-to-date educational standards and ethical codes of art therapy, the book covers the full range of settings and art therapy approaches. This text will prepare art therapy graduate students and practitioners to lead groups in a variety of settings, theoretical approaches, and applications."
280,280,280,280,https://d1w7fb2mkkr3kw.cloudfront.net/assets/images/book/mid/9781/5924/9781592401536.jpg,The Power of the Actor,Ivana Chubbuck,Paperback,4.0,17.90,$,26.5,9781592401536,Art-Photography,dataset/Art-Photography/0000281.jpg,"In The Power of the Actor, a Los Angeles Times bestseller, premier acting teacher and coach Ivana Chubbuck reveals her cutting-edge technique, which has launched some of the most successful acting careers in Hollywood. The first book from the instructor who has taught Charlize Theron, Brad Pitt, Elisabeth Shue, Djimon Hounsou, and Halle Berry, The Power of the Actor guides you to dynamic and effective results. For many of today’s major talents, the Chubbuck Technique is the leading edge of acting for the twenty-first century. Ivana Chubbuck has developed a curriculum that takes the theories of the acting masters, such as Stanislavski, Meisner, and Hagen, to the next step by utilizing inner pain and emotions, not as an end in itself, but rather as a way to drive and win a goal. In addition to the powerful twelve-step process, the book takes well-known scripts, both classic and contemporary, and demonstrates how to precisely apply Chubbuck’s script-analysis process. The Power of the Actor is filled with fascinating and inspiring behind-the-scenes accounts of how noted actors have mastered their craft and have accomplished success in such a difficult and competitive field."
281,281,281,281,https://d1w7fb2mkkr3kw.cloudfront.net/assets/images/book/mid/9781/5742/9781574219579.jpg,Nature Mandalas Coloring Book,Thaneeya Mcardle,Paperback,4.0,6.83,$,7.8,9781574219579,Art-Photography,dataset/Art-Photography/0000282.jpg,"Mandala symmetry provides the canvas for 30 fanciful designs populated by dragonflies, daisies, seashells, and other motifs from nature and set into arrangements of leaves, vines, trees, and other flora."
282,282,282,282,https://d1w7fb2mkkr3kw.cloudfront.net/assets/images/book/mid/9780/7935/9780793577750.jpg,Hal Leonard Music Flash Cards,And Jeff Schroedl Blake,Cards,0.0,8.09,$,,9780793577750,Art-Photography,dataset/Art-Photography/0000283.jpg,"(Educational Piano Library). 120 color-coded cards to learn basic musical symbols, all notes from low ledger C to high ledger C, and rhythm patterns in 4/4 and 3/4. Also includes cards that focus on recognition of steps and skips on the staff."
283,283,283,283,https://d1w7fb2mkkr3kw.cloudfront.net/assets/images/book/mid/9781/8499/9781849900010.jpg,Life on Air,Sir David Attenborough,Paperback,4.5,11.18,$,12.9,9781849900010,Art-Photography,dataset/Art-Photography/0000284.jpg,"Radio Four has been described as 'the greatest broadcasting channel in the world', the 'heartbeat of the BBC', a cultural icon of Britishness, and the voice of Middle England. Defined by its rich mix, encompassing everything from journalism and drama to comedy, quizzes, and short-stories. Many of its programmes - such as Today ,The Archers, Woman's Hour, The Hitchhiker's Guide To the Galaxy, Gardeners' Question Time, and The Shipping Forecast - have been part of British life for decades. Others, less successful, have caused offence and prompted derision. Born as it was in the Swinging Sixties, Radio Four's central challenge has been to change with the times, while trying not to lose faith with those who see it as a standard-bearer for quality, authoritativeness, or simply 'old-fashioned' BBC values. In this first major behind-the-scenes account of the station's history, David Hendy - a former producer for Radio Four - draws on privileged access to the BBC's own archives and new interviews with key personnel to illuminate the arguments and controversies behind the creation of some of its most popular programmes. He reveals the station's struggle to justify itself in a television age, favouring clear branding and tightly-targeted audiences, with bitter disputes between the BBC and its fiercely loyal listeners. The story of these struggles is about more than the survival of one radio network: Radio Four has been a lightning rod for all sorts of wider social anxieties over the past forty years. A kaleidoscopic view of the changing nature of the BBC, the book provides a gripping insight into the very nature of British life and culture in the last decades of the twentieth century."
284,284,284,284,https://d1w7fb2mkkr3kw.cloudfront.net/assets/images/book/mid/9780/7390/9780739048122.jpg,Suzuki Violin School: v.2,Shinichi Suzuki,Paperback,4.5,8.04,$,11.95,9780739048122,Art-Photography,dataset/Art-Photography/0000285.jpg,"Teach violin with the popular Suzuki Violin School. Titles: Principles of Study and Guidance * Twinkle, Twinkle, Little Star Variations (Shinichi Suzuki) * Lightly Row (Folk Song) * Song of the Wind (Folk Song) * Go Tell Aunt Rhody (Folk Song) * O Come, Little Children (Folk Song) * May Song (Folk Song) * Long, Long Ago (T.H. Bayly) * Allegro (Shinichi Suzuki) * Perpetual Motion (Shinichi Suzuki) * Allegretto (Shinichi Suzuki) * Andantino (Shinichi Suzuki) * Etude (Shinichi Suzuki) * Minuet 1, Minuett III from Suite in G Minor for Klavier, BWV 822 (J.S. Bach) * Minuet 2, Minuet, BWV Anh. II 116 from Notebook for Anna Magdalena Bach (J.S. Bach) * Minuet 3, Minuet BWV Anh. II 114/Anh. III 183 (J.S. Bach) * The Happy Farmer from Album for the Young, Op. 68, No. 10 (R. Schumann) * Gavotte (F.J. Gossec). Revised edition features: New engravings in a 9"" x 12"" format New editing of pieces, including bowings and fingerings 16 additional pages Additional exercises, some from Dr. Suzuki, plus additional insight and suggestions for teachers Glossary of terms in English, French, German and Spanish Musical notation guide Fingerboard position New photos CD features new recordings by Bill Preucil, Jr and piano accompaniments recorded without the violin part. This title is available in SmartMusic."
285,285,285,285,https://d1w7fb2mkkr3kw.cloudfront.net/assets/images/book/mid/9780/9076/9780907610663.jpg,"How to Draw Comics the ""Marvel"" Way",Stan Lee,Paperback,4.0,12.28,$,13.9,9780907610663,Art-Photography,dataset/Art-Photography/0000286.jpg,"In Stan Lee's How to Draw Comics, Stan Lee reveals his secrets for: * Costumes * Penciling, Inking & Coloring * Lettering & Word Balloons * Digital Advances * Perspective & Foreshortening * What Makes Great Action * Page & Panel Layout * Covers * Creating a Portfolio * Getting Work When it comes to comic books, one name says it all: Stan Lee. His characters are classics. His industry knowledge is vast. His creativity is boundless. And now, he’s sharing what he knows with you, Grasshopper! His cohorts have always been—and still are—some of the best in the business: Jack Kirby, John Romita, Sr., Neal Adams, Gil Kane, Mike Deodato, Jr., Frank Cho, and Jonathan Lau, and many others, Stan includes their work here and discusses what exactly makes it so great. He touches on all the important stuff: anatomy, foreshortening, perspective, action, penciling, inking, hand lettering vs. digital lettering, color, character and costume design, panel flow, materials and tools, computers, file formats, and software. He includes an overview of the history and development of the comic book industry, and there’s an extensive section on various types of covers—the super important element that makes the reader want to pick up that comic! In a world where good battles evil at every turn and the hero fights valiantly to get the girl, no stone is left unturned! Here you’ll also find info on all the small details—that really aren’t so small: word balloons, thought balloons, whisper balloons, bursts, sound effect lettering, and splash pages! And KA-BLAMMM! . . . once you’ve created your art, then what? Lest you think Stan would turn you out into the wilderness without a road map, fellow traveler, there’s also information on preparing and submitting your portfolio, on getting work, and on suggested reading and schools. Stan Lee’s How to Draw Comics features a cover that reunites long time collaborator John Romita Sr. and original cover artist of How to Draw Comics the Marvel Way. John Romita Sr. was most famous for his collaboration on The Amazing Spider-Man with Stan Lee! It’s time for a new approach . . . “a cornucopia of cutting-edge, techno-savvy instructions to lead you down the freshly laid yellow brick road of creativity.” It’s time for a book that takes you on the new journey of creating comic books for the 21st century and beyond! Excelsior!"
286,286,286,286,https://d1w7fb2mkkr3kw.cloudfront.net/assets/images/book/mid/9780/7509/9780750985598.jpg,prettycitylondon,Siobhan Ferguson,Hardback,4.5,23.59,$,30.9,9780750985598,Art-Photography,dataset/Art-Photography/0000287.jpg,"This beautiful collection of images will take you past London's famous landmarks, and into the pretty hidden gems beyond. From secluded mews to undiscovered cafes, flower markets and tree-lined streets, prettycitylondon champions the quiet, gentle moments that allow you to escape in a huge capital city like London.If you know where to look, you will find that traditional shop fronts, vintage transport, artisan bakeries, florists and bookstores are but a hop skip and a jump from the centre, and some right bang in the middle.Curated by founder and editor of Instagram's @prettycitylondon, this stunning guide also includes tips on how to photograph and plan your own prettycitylondon experience, whether on foot or from afar."
287,287,287,287,https://d1w7fb2mkkr3kw.cloudfront.net/assets/images/book/mid/9781/5847/9781584796725.jpg,Printing by Hand,Lena Corwin,Spiral bound,4.0,17.09,$,19.1,9781584796725,Art-Photography,dataset/Art-Photography/0000288.jpg,
288,288,288,288,https://d1w7fb2mkkr3kw.cloudfront.net/assets/images/book/mid/9781/4736/9781473689305.jpg,Blowing the Bloody Doors Off,Michael Caine,Hardback,4.0,16.58,$,24.0,9781473689305,Art-Photography,dataset/Art-Photography/0000289.jpg,"Hollywood legend Michael Caine shares wisdom and stories from his remarkable career in this ""engrossing"" memoir that ""shines with positive energy"" (Library Journal, starred review). One of our best-loved actors, Michael Caine has starred in over 100 films in his six-decade career, spanning classic movies like Alfie, Zulu, and The Italian Job to playing Alfred opposite Christian Bale's Batman in Christopher Nolan's blockbuster Dark Knight trilogy. Caine has excelled in every kind of role--with a skill that's made it look easy. Caine knows what success takes. He's made it to the pinnacle of his profession from humble origins. But as he says, ""Small parts can lead to big things. And if you keep doing things right, the stars will align when you least expect it."" Still working and more beloved than ever, Caine now shares everything he's learned-and ""his fans will be rewarded, as will anyone seeking an enjoyable, inspirational read"" (Library Journal)."
