,Unnamed: 0,Unnamed: 0.1,Unnamed: 0.1.1,image,name,author,format,book_depository_stars,price,currency,old_price,isbn,category,img_paths,description
730,730,730,730,https://d1w7fb2mkkr3kw.cloudfront.net/assets/images/book/mid/9781/5742/9781574216714.jpg,Totally Tangled,Sandy Bartholomew,Paperback,4.0,10.72,$,13.9,9781574216714,Art-Photography,dataset/Art-Photography/0000731.jpg,"There is no more legendary case in American legal history than Dred Scott v. Sanford. An extraordinary example of a slave suing his master for freedom, it led to a devastating pro-slavery ruling by Chief Justice Roger Taney in the Supreme Court and helped precipitate the Civil War. But was it so remarkable? Did others fight for liberty in court? In Redemption Songs, legal scholar Lea VanderVelde unearths the astonishing history of how slaves challenged the peculiar institution"" with that most American of weapons, litigation. The author, together with Missouri's state archivist and other researchers, found roughly 300 ""freedom suits"" filed in St. Louis between 1814 and 1860. More than 100 ended with the words, ""Plaintiff be liberated and entirely set free from the defendant."" Slaves based their claims on four grounds: they were Native Americans, previously had been free, had lived in free territory, or had a free mother. VanderVelde selects a dozen lawsuits from across this period for close examination; each opens a window on a closed world of oppression-and defiance. Here, for example, is the saga of Moses Shipman; freed by Revolutionary War veteran David Shipman, he fled from Kentucky to Illinois in the 1820s, was kidnapped with his family, and dragged back to St. Louis. Here, too, is the story of Leah Charleville, a wily survivor living in a shadowy world of illegality, playing off two free black men as her lovers and hosting a ring of thieves at her boarding house. Savvy in the ways of the law, she went to court four times, securing freedom for herself and her children. With deep appreciation for the courage required for a slave to challenge a master in court, VanVelde reshapes our understanding of border-state slavery and the impact of the seemingly powerless on American law."""
731,731,731,731,https://d1w7fb2mkkr3kw.cloudfront.net/assets/images/book/mid/9781/5578/9781557833730.jpg,Stella Adler,Howard Kissel,Hardback,4.0,19.69,$,27.95,9781557833730,Art-Photography,dataset/Art-Photography/0000732.jpg,
732,732,732,732,https://d1w7fb2mkkr3kw.cloudfront.net/assets/images/book/mid/9781/4197/9781419717871.jpg,kate spade new york: all in good taste,Kate Spade New York,Hardback,4.0,15.60,$,28.19,9781419717871,Art-Photography,dataset/Art-Photography/0000733.jpg,"The third book with Kate Spade New York, all in good taste is a charming entertaining guide to throwing chic, stylish get-togethers. The culture of entertaining is just as important as the food and drinks you serve, the flowers on your table and the music on your speakers; all in good taste sends rigid rules out the door and invites in unpretentious ideas that are easy, festive, and authentic, always with an air of deliberate polish. Filled with how-to's, personal essays, anecdotes, menus, tips, recipes and a liberal dash of style, all in good taste will transform you into the hostess everyone wants an invitation from. The book covers all of the essential lost arts how to shuck an oyster, curating a stellar guest list, dinner-table topics, cocktails in the city right alongside modern conundrums like food photo etiquette and innovations like serving pot pies in teacups. Whether you entertain a little or a lot, or just love being the person everyone wants to sit next to at dinner, all in good taste is the modern classic you'll treasure and dog-ear for years."
733,733,733,733,https://d1w7fb2mkkr3kw.cloudfront.net/assets/images/book/mid/9780/7935/9780793562657.jpg,Hal Leonard Student Piano Library,Phillip Keveren,Paperback,4.0,8.02,$,9.0,9780793562657,Art-Photography,dataset/Art-Photography/0000734.jpg,"In this remarkable memoir, Anna Goldsworthy recalls her first steps towards a life in music, from childhood piano lessons with a local jazz muso to international success as a concert pianist. As she discovers passion and ambition, and confronts doubt and disappointment, she learns about much more than tone and technique. This is a story of the getting of wisdom, tender and bittersweet. With wit and affection, Goldsworthy captures the hopes and uncertainties of youth, the fear and exhilaration of performing, and the complex bonds between teacher and student. An unforgettable cast of characters joins her: her family; her friends and rivals; and her teacher, Mrs Sivan, who inspires and challenges her in equal measure, and who transforms what seems an impossible dream into something real and sustaining."
734,734,734,734,https://d1w7fb2mkkr3kw.cloudfront.net/assets/images/book/mid/9780/8828/9780882848204.jpg,"Alfred's Basic Piano Library Theory, Bk 1b",Willard A Palmer,Paperback,4.0,7.00,$,,9780882848204,Art-Photography,dataset/Art-Photography/0000735.jpg,"This easy step-by-step method emphasizes correct playing habits and note reading through interval recognition. Lesson Book 1B begins by reviewing the concepts taught in Lesson Book 1A, then introduces new concepts such as incomplete measures, tempo markings, eighth notes and rests, using the damper pedal, half steps and whole steps. It also introduces the major scale through the concept of tetrachords. Songs Include: Brother John * Carol in G Major * The Carousel * The Clown * Concert Time * A Cowboy's Song * The Cuckoo * French Lullaby * Good King Wenceslas * Good Morning to You! * Good Sounds * Grandpa's Clock * The Greatest Show on Earth! * G's in the ""BAG"" * Hail to Thee, America! * Harp Song * Happy Birthday to You! * Indians * Join the Fun * The Magic Man * Money Can't Buy Everything * Music Box Rock * Oom-Pa-Pa! * Ping Pong * The Planets * The Rainbow * Sonatina * Step Right Up! * Waltz Time * When Our Band Goes Marching By! * When the Saints Go Marching In * The Whirlwind * The Windmill * Yankee Doodle"
735,735,735,735,https://d1w7fb2mkkr3kw.cloudfront.net/assets/images/book/mid/9781/9094/9781909414280.jpg,The Art of Loish,Lois Van Baarle,Hardback,4.5,20.31,$,26.99,9781909414280,Art-Photography,dataset/Art-Photography/0000736.jpg,"In this visually stunning hardback book, globally loved artist Lois van Baarle, AKA Loish, explores the origins, influences, and features of her style, and helps readers do the same deep dive into their own style. The Style of Loish is her third book with 3dtotal Publishing, a natural progression from the bestselling The Art of Loish (2016) and The Sketch Book of Loish (2018). To date these titles have sold over 85,000 copies combined worldwide, with numerous reprints to keep up with demand. Published exclusively by 3dtotal Publishing, Loish is building a carefully considered body of work, with each book making sense both alone, and as part of a growing, highly collectible series. With this in mind, The Style of Loish now sees the artist explore her own style through several facets of her work, including creating volume, choosing color, establishing flow, and the ideas and subjects themselves. While looking at the motivation behind her own work, Loish also guides the reader through ideas and tutorials to help them identify, understand, and even evolve their own style. The book bursts with brand new, specially commissioned art that provides a unique opportunity to understand the foundations of Loish's style. She reveals the journey she took to pinpoint when and how her style was created. Combined with candid advice and a passion for supporting fellow artists, Loish has written a beautiful, inspirational, and practical book for artists of all styles and abilities that is sure to be another bestseller."
736,736,736,736,https://d1w7fb2mkkr3kw.cloudfront.net/assets/images/book/mid/9783/8327/9783832797591.jpg,Before They Pass Away,Jimmy Nelson,Hardback,4.5,103.97,$,131.6,9783832797591,Art-Photography,dataset/Art-Photography/0000737.jpg,
737,737,737,737,https://d1w7fb2mkkr3kw.cloudfront.net/assets/images/book/mid/9781/4081/9781408107669.jpg,Abracadabra Flute (Pupil's book),Malcolm Pollock,Paperback,4.5,11.73,$,,9781408107669,Art-Photography,dataset/Art-Photography/0000738.jpg,"Abracadabra Flute has become a classic in the market, and here is a brand new edition. The cover has been redesigned, the music re-set, and new illustrations commissioned. Some new material has been added, supplying extra help where new notes are introduced and reinforcement exercises for tricky corners. As well as the new edition, there is now a CD available. Performed by professional musicians, it demonstrates each piece on flute with piano accompaniments from our book Abracadabra Flute Piano Accompaniments, enabling the pupil to hear how the pieces sound. Such a CD is invaluable for ensemble experience, and offers all the fun of playing with an accompaniment - perfect for home practice and concerts alike."
738,738,738,738,https://d1w7fb2mkkr3kw.cloudfront.net/assets/images/book/mid/9780/8828/9780882848198.jpg,"Alfred's Basic Piano Library Theory, Bk 2",Willard A Palmer,Paperback,4.0,6.36,$,7.0,9780882848198,Art-Photography,dataset/Art-Photography/0000739.jpg,"This easy step-by-step method emphasizes correct playing habits and note reading through interval recognition. Lesson Book 2 continues where Level 1B finishes. This book introduces dotted half notes and dotted quarter notes, plus intervals of 6ths, 7ths and octaves. Teaches greater movement of the hands, including crossing two over one and scalework. Students will also learn more about triads, primary chords, and blocked and broken chords. Songs Include: 18th Century Dance * Alouette * Blue Scales * Calypso Carnival * The Can-Can * Cockles and Mussels * The Galway Piper * Get Away! * Got Lotsa Rhythm * Kum-ba-yah! * Lavender's Blue * London Bridge * Lone Star Waltz * Malaguena * Nick Nack Paddy Wack * Ode to Joy * Oh! Susanna! * On the Bridge at Avignon * Our Special Waltz * Prelude * Red River Valley * Sarasponda * Square Dance * When You Grow Up * Why Am I Blue?"
739,739,739,739,https://d1w7fb2mkkr3kw.cloudfront.net/assets/images/book/mid/9780/9614/9780961470159.jpg,The Jazz Piano Book,Mark Levine,Spiral bound,4.5,34.87,$,40.0,9780961470159,Art-Photography,dataset/Art-Photography/0000740.jpg,"The most highly-acclaimed jazz theory book ever published! Over 500 pages of comprehensive, but easy to understand text covering every aspect of how jazz is constructed---chord construction, II-V-I progressions, scale theory, chord/scale relationships, the blues, reharmonization, and much more. A required text in universities world-wide, translated into five languages, endorsed by Jamey Aebersold, James Moody, Dave Liebman, etc."
740,740,740,740,https://d1w7fb2mkkr3kw.cloudfront.net/assets/images/book/mid/9780/7935/9780793533923.jpg,Hal Leonard Guitar Method Book 1 Second Edition,Will Schmid,Paperback,4.0,10.71,$,14.0,9780793533923,Art-Photography,dataset/Art-Photography/0000741.jpg,"(Guitar Method). The Hal Leonard Guitar Method is designed for anyone just learning to play acoustic or electric guitar. It is based on years of teaching guitar students of all ages, and it also reflects some of the best guitar teaching ideas from around the world. Book 1 includes tuning; playing position; musical symbols; notes in first position; C, G, G7, D, D7, A7, and Em chords; rhythms through eighth notes; strumming and picking; over 80 great songs, riffs, and examples."
741,741,741,741,https://d1w7fb2mkkr3kw.cloudfront.net/assets/images/book/mid/9781/6167/9781616776244.jpg,Piano Adventures,Nancy Faber,Paperback,4.0,7.59,$,,9781616776244,Art-Photography,dataset/Art-Photography/0000742.jpg,"(Faber Piano Adventures ). The appeal of popular music spans generations and genres. In this collection of 27 hits, enjoy folk tunes like ""Ashokan Farewell"" and ""Bridge Over Troubled Water,"" movie themes from James Bond and Batman , Broadway numbers from Evita and A Little Night Music , and chart-toppers performed by Michael Jackson, Adele, Billy Joel, and more. Adult Piano Adventures Popular Book 2 provides this variety, yet with accessible arrangements for the progressing pianist. Students may advance through the book alongside method studies, or jump to all their favorites. Optional chord symbols above the staff guide understanding and personal expression."
742,742,742,742,https://d1w7fb2mkkr3kw.cloudfront.net/assets/images/book/mid/9781/8444/9781844484515.jpg,Billy Showell's Botanical Painting in Watercolour,Billy Showell,Hardback,4.5,19.36,$,24.0,9781844484515,Art-Photography,dataset/Art-Photography/0000743.jpg,"In this beautiful book, Billy Showell provides a fascinating and invaluable insight into the techniques she uses to produce her stunning botanical paintings in watercolour."
743,743,743,743,https://d1w7fb2mkkr3kw.cloudfront.net/assets/images/book/mid/9780/9411/9780941188241.jpg,Directing Actors,Judith Weston,Paperback,4.5,15.63,$,20.1,9780941188241,Art-Photography,dataset/Art-Photography/0000744.jpg,"Directing Actors: A Practical Aesthetics Approach is the first book to apply the Practical Aesthetics acting technique to the craft of directing. Lee Cohn lays out a step-by-step, no-nonsense methodology for the director that includes a deep dive into the mechanics of storytelling, the rehearsal process, working with writers, and the practical realities of the director’s job. Featuring end-of-chapter exercises, this book provides a clear and effective means of breaking down a script in order to tell a story with clarity, simplicity, and dramatic force and gives directors a clear working vocabulary that will allow effective communication with actors. The techniques in this book are applicable to any theatrical style and any media platform in which a director might work. Written in an accessible, conversational style, this book strips the process of directing down to its most essential components to explain how to become an ""actor’s director."" A must-read for students in directing courses and professional directors working with actors who prescribe to the Practical Aesthetics technique, as well as anyone interested in the process of working with actors, Directing Actors will help directors to get the very best their actors are capable of while approaching the work with a joyful, open spirit."
744,744,744,744,https://d1w7fb2mkkr3kw.cloudfront.net/assets/images/book/mid/9780/9882/9780988263406.jpg,Tony Northrup's DSLR Book,Tony Northrup,Paperback,4.5,22.52,$,24.0,9780988263406,Art-Photography,dataset/Art-Photography/0000745.jpg,"The top-rated and top-selling photography ebook since 2012 and the first ever Gold Honoree of the Benjamin Franklin Digital Award, gives you five innovations no other book offers: Free video training. 9+ HOURS of video training integrated into the book’s content (requires Internet access). Travel around the world with Tony and Chelsea as they teach you hands-on. Appendix A lists the videos so you can use the book like an inexpensive video course.Classroom-style teacher and peer help. After buying the book, you get access to the private forums on this site, as well as the private Stunning Digital Photography Readers group on Facebook where you can ask the questions and post pictures for feedback from Tony, Chelsea, and other readers. It’s like being able to raise your hand in class and ask a question! Instructions are in the introduction.Lifetime updates. This book is regularly updated with new content (including additional videos) that existing owners receive for free. Updates are added based on reader feedback and questions, as well as changing photography trends and new camera equipment. This is the last photography book you’ll ever need.Hands-on practices. Complete the practices at the end of every chapter to get the real world experience you need.500+ high resolution, original pictures. Detailed example pictures taken by the author in fifteen countries demonstrate both good and bad technique. Many pictures include links to the full-size image so you can zoom in to see every pixel. Most photography books use stock photography, which means the author didn’t even take them. If an author can’t take his own pictures, how can he teach you? In this book, Tony Northrup (award-winning author of more than 30 how-to books and a professional portrait, wildlife, and landscape photographer) teaches the art and science of creating stunning pictures. First, beginner photographers will master: CompositionExposureShutter speedApertureDepth-of-field (blurring the background)ISONatural lightFlashTroubleshooting blurry, dark, and bad picturesPet photographyWildlife photography (mammals, birds, insects, fish, and more)Sunrises and sunsetsLandscapesCityscapesFlowersForests, waterfalls, and riversNight photographyFireworksRaw filesHDRMacro/close-up photography Advanced photographers can skip forward to learn the pro’s secrets for: Posing men and women. including corrective posing (checklists provided)Portraits (candid, casual, formal, and underwater)Remotely triggering flashesUsing bounce flash and flash modifiersUsing studio lighting on any budgetBuilding a temporary or permanent studio at homeShooting your first weddingHigh speed photographyLocation scouting/finding the best spots and timesPlanning shoots around the sun and moonStar trails (via long exposure and image stacking)Light paintingEliminating noiseFocus stacking for infinite depth-of-fieldUnderwater photographyGetting close to wildlifeUsing electronic shutter triggersPhotographing moving carsPhotographing architecture and real estate"
745,745,745,745,https://d1w7fb2mkkr3kw.cloudfront.net/assets/images/book/mid/9780/8230/9780823058792.jpg,Wild Color,Jenny Dean,Paperback,4.5,22.33,$,24.0,9780823058792,Art-Photography,dataset/Art-Photography/0000746.jpg,
746,746,746,746,https://d1w7fb2mkkr3kw.cloudfront.net/assets/images/book/mid/9780/9229/9780922915941.jpg,Lords Of Chaos - 2nd Edition,Didrik Soderlind,Paperback,3.5,18.65,$,21.1,9780922915941,Art-Photography,dataset/Art-Photography/0000747.jpg,"“* * * * * *! The most incredible story in the history of music … a heavyweight book.”—Kerrang! “An unusual combination of true crime journalism, rock and roll reporting and underground obsessiveness, Lords of Chaos turns into one of the more fascinating reads in a long time.”—Denver Post A narrative feature film based on this award-winning book has just gone into production."
747,747,747,747,https://d1w7fb2mkkr3kw.cloudfront.net/assets/images/book/mid/9781/9311/9781931160490.jpg,Two Knotty Boys Showing You The Ropes,Two Knotty Boys,Paperback,4.0,15.61,$,19.1,9781931160490,Art-Photography,dataset/Art-Photography/0000748.jpg,"This entertaining, photo-illustrated book teaches 37 step-by-step techniques for tying sensual and beautiful rope bondage. Two Knotty Boys Showing You The Ropes is designed for fun, easy, hands-on practice with more than 750 photographs and captions, tied and written by the world-acclaimed bondage experts the Two Knotty Boys."
748,748,748,748,https://d1w7fb2mkkr3kw.cloudfront.net/assets/images/book/mid/9780/3167/9780316787536.jpg,Our Band Could Be Your Life,Michael Azerrad,Paperback,4.0,15.27,$,16.0,9780316787536,Art-Photography,dataset/Art-Photography/0000749.jpg,"Bob Mould, Grant Hart, and Greg Norton formed Hüsker Dü in 1979 as a wildly cathartic outfit fueled by a cocktail of anger, volume, and velocity. Here's the first book to dissect the trio that countless critics and musicians have cited as one of the most influential bands of the 1980s. Author Andrew Earles examines how Hüsker Dü became the first hardcore band to marry pop melodies with psychedelic influences and ear-shattering volume. Readers witness the band create the untouchable noise-pop of LPs like New Day Rising, Flip Your Wig, and Candy Apple Grey, not to mention the sprawling double-length Zen Arcade. Few bands from the original American indie movement did more to inform the alternative rock styles that breached the mainstream in the 1990s. Hüsker Dü truly were visionaries."
749,749,749,749,https://d1w7fb2mkkr3kw.cloudfront.net/assets/images/book/mid/9780/4522/9780452271876.jpg,Rebel without a Crew,Robert Rodriguez,Paperback,4.0,14.28,$,14.49,9780452271876,Art-Photography,dataset/Art-Photography/0000750.jpg,"Famed independent screenwriter and director Robert Rodriguez (Sin City, Once Upon a Time in Mexico, Spy Kids, Machete) discloses all the unique strategies and original techniques he used to make his remarkable debut film El Mariachi on a shoestring budget. This is both one man's remarkable story and an essential guide for anyone who has a celluloid story to tell and the dreams and determination to see it through. Part production diary, part how-to manual, Rodriguez unveils how he was able to make his influential first film on only a $7,000 budget. Also included is the appendix, ""The Ten Minute Film Course,” a tell-all on how to save thousands of dollars on film school and teach yourself the ropes of film production, directing, and screenwriting. A perfect gift for the aspiring filmmaker."
750,750,750,750,https://d1w7fb2mkkr3kw.cloudfront.net/assets/images/book/mid/9781/7604/9781760408183.jpg,200 Women,Ruth Hobday,Hardback,0.0,36.32,$,37.28,9781760408183,Art-Photography,dataset/Art-Photography/0000751.jpg,
751,751,751,751,https://d1w7fb2mkkr3kw.cloudfront.net/assets/images/book/mid/9780/0621/9780062121653.jpg,The Tiny Book of Tiny Stories: Volume 3,Joseph Gordon-Levitt,Hardback,4.5,9.59,$,15.0,9780062121653,Art-Photography,dataset/Art-Photography/0000752.jpg,"This e-book contains six exclusive tiny videos created by the hitRECord community to enhance the Tiny Stories reading experience. From hitRECord, the immensely popular open collaborative production company, and its founder, Golden Globe-nominated actor Joseph Gordon-Levitt, comes The Tiny Book of Tiny Stories: Volume 1. The universe is not made of atoms; it’s made of tiny stories. To create The Tiny Book of Tiny Stories: Volume 1, Joseph Gordon-Levitt, known within the hitRECord community as RegularJOE—directed thousands of collaborators to tell tiny stories through words and art. With the help of the entire creative collective, Gordon-Levitt culled, edited and curated over 8,500 contributions into this finely tuned collection of original art from 67 contributors. Reminiscent of the 6-Word Memoir series, The Tiny Book of Tiny Stories: Volume 1 brings together art and voices from around the world to unite and tell stories that defy size. Please note that due to the large file size of these special features this enhanced e-book may take longer to download than a standard e-book."
752,752,752,752,https://d1w7fb2mkkr3kw.cloudfront.net/assets/images/book/mid/9781/4236/9781423646594.jpg,Magical Dawn Coloring Book,Hanna Karlzon,Hardback,5.0,12.66,$,16.0,9781423646594,Art-Photography,dataset/Art-Photography/0000753.jpg,"Magical Dawn by bestselling artist Hanna Karlzon, boasts 96-pages of sparkling crystals, fluttering wings, and mushroom-studded abodes. The beautiful hardbound edition encourages artists to display their copy on a coffee table or bookshelf, and makes a great gift. Complete the collection with the Magical Dawn 20 Postcards, ideally priced and perfectly sized; and the Magical Dawn Artist's Edition featuring twenty oversized art card designs to hang on one's wall or share with friends. The variety of formats in each of Hannah Karlzon's unique collections encourages collecting and gifting. Hanna Karlzon who has an art teaching degree from Umea University, has run her own business as a freelance designer since 2013. Magical Dawn is her third coloring book series, following her debut of Daydreams and Summer Nights in 2016."
