,Unnamed: 0,image,name,author,format,book_depository_stars,price,currency,old_price,isbn,category,img_paths,description
715,715,https://d1w7fb2mkkr3kw.cloudfront.net/assets/images/book/mid/9780/7387/9780738733647.jpg,Anne Stokes Gothic Tarot Deck,Lo Scarabeo,Cards,4.5,19.12,$,27.0,9780738733647,Stationery,dataset/Stationery/0000716.jpg,"An essential key to understanding The Gothic Tarot ¿ the critically acclaimed and best-selling Tarot deck by artist Joseph Vargo, featuring gargoyles, vampires, ghosts, and dark angels ¿ this book offers the artist's personal insights concerning the mythological and occult symbolism hidden within his artwork. The Gothic Tarot Compendium is a comprehensive resource that contains illustrations of all 78 cards of the Major and Minor Arcana, translates their symbolic meanings, and provides a detailed explanation of their personal significance, allowing readers to utilize The Gothic Tarot to its fullest divinatory potential. Includes detailed instructions regarding several traditional and original card layouts that reinforce the gothic theme of the artwork."
716,716,https://d1w7fb2mkkr3kw.cloudfront.net/assets/images/book/mid/9788/8661/9788866134206.jpg,Moleskine Pebble Grey Ruled Cahier Pocket Journal (3 Set),Moleskine,Diary,5.0,6.89,$,6.9,9788866134206,Stationery,dataset/Stationery/0000717.jpg,"NATIONAL BESTSELLER SHORTLISTED for the 2022 Rakuten Kobo Emerging Writer Prize A GLOBE AND MAIL BEST BOOK OF THE YEAR ""Unreconciled is one hell of a good book. Jesse Wente’s narrative moves effortlessly from the personal to the historical to the contemporary. Very powerful, and a joy to read."" —Thomas King, author of The Inconvenient Indian and Sufferance A prominent Indigenous voice uncovers the lies and myths that affect relations between white and Indigenous peoples and the power of narrative to emphasize truth over comfort. Part memoir and part manifesto, Unreconciled is a stirring call to arms to put truth over the flawed concept of reconciliation, and to build a new, respectful relationship between the nation of Canada and Indigenous peoples. Jesse Wente remembers the exact moment he realized that he was a certain kind of Indian--a stereotypical cartoon Indian. He was playing softball as a child when the opposing team began to war-whoop when he was at bat. It was just one of many incidents that formed Wente's understanding of what it means to be a modern Indigenous person in a society still overwhelmingly colonial in its attitudes and institutions. As the child of an American father and an Anishinaabe mother, Wente grew up in Toronto with frequent visits to the reserve where his maternal relations lived. By exploring his family's history, including his grandmother's experience in residential school, and citing his own frequent incidents of racial profiling by police who'd stop him on the streets, Wente unpacks the discrepancies between his personal identity and how non-Indigenous people view him. Wente analyzes and gives voice to the differences between Hollywood portrayals of Indigenous peoples and lived culture. Through the lens of art, pop culture, and personal stories, and with disarming humour, he links his love of baseball and movies to such issues as cultural appropriation, Indigenous representation and identity, and Indigenous narrative sovereignty. Indeed, he argues that storytelling in all its forms is one of Indigenous peoples' best weapons in the fight to reclaim their rightful place. Wente explores and exposes the lies that Canada tells itself, unravels ""the two founding nations"" myth, and insists that the notion of ""reconciliation"" is not a realistic path forward. Peace between First Nations and the state of Canada can't be recovered through reconciliation--because no such relationship ever existed."
717,717,https://d1w7fb2mkkr3kw.cloudfront.net/assets/images/book/mid/9781/2502/9781250294838.jpg,Zendoodle Coloring Presents Gnomes in the Neighborhood,Denyse Klette,Paperback,4.0,13.58,$,17.0,9781250294838,Stationery,dataset/Stationery/0000718.jpg,"A gorgeous new book of whimsical creatures to color First she changed the way we looked at fairies, then mermaids, and now illustrator Denyse Klette turns her talented eye (and pen) to gnomes with a brand-new book of 62 gloriously detailed illustrations to color. Gnomes in the garden, celebrating Christmas, and exploring their whimsical world light up the pages of this spectacular coloring book."
718,718,https://d1w7fb2mkkr3kw.cloudfront.net/assets/images/book/mid/9781/5604/9781560440147.jpg,Everyone's Mandala Colouring Book: v. 1,Monique Mandali,Paperback,4.0,11.23,$,,9781560440147,Stationery,dataset/Stationery/0000719.jpg,"Inside this exquisite coloring book for grownups are 96 ready-to-color art activities that will transport you to a dream world of delightful gardens. Each illustration is so richly detailed that it might take you hours to complete just one page. But you don't need to have the skills of an artist to personalize these intricate drawings. Talented artist Valentina Harper provides easy-to-follow tips on her distinctive patterning techniques. And as an added bonus, best-selling craft author Marie Browning joins the fun with beautiful coloring examples. Printed on high quality extra-thick paper that won't bleed through, all pages are pre-perforated for easy removal and display. Whether you use markers, gel pens, watercolors, or colored pencils, this big book is the perfect way to relax and enjoy coloring."
719,719,https://d1w7fb2mkkr3kw.cloudfront.net/assets/images/book/mid/9780/4864/9780486420578.jpg,Dragons Coloring Book,Christy Shaffer,Paperback,4.0,5.05,$,,9780486420578,Stationery,dataset/Stationery/0000720.jpg,"Thirty full-page illustrations to color depict an international array of dragons, including a Balinese spirit king, Greek temple guardian, English wyvern, and creatures from Norse, Polish, Egyptian, and other cultures. Captions."
720,720,https://d1w7fb2mkkr3kw.cloudfront.net/assets/images/book/mid/9789/9004/9789900493303.jpg,Bible Tab,Tabbies,Paperback,4.5,4.81,$,5.99,9789900493303,Stationery,dataset/Stationery/0000721.jpg,"Put each of the books in the Bible at your fingertips. A total of 84 elegant foil-edged tabs are designed for Old and New Testaments, as well as tabs for additional books found in the Catholic Bible. Also includes a selection of special tabs for marking your own Life Verse, concordance, and more. Design derived from The Psalter in the German Translation of Martin Luther."
721,721,https://d1w7fb2mkkr3kw.cloudfront.net/assets/images/book/mid/9781/6334/9781633440784.jpg,Lord of the Rings LCG: The Dread Realm Adventure Pack,Fantasy Flight Games,Game,0.0,10.75,$,16.49,9781633440784,Stationery,dataset/Stationery/0000722.jpg,"Presents the complete account of the making of the Lord of the Rings trilogy music score, and includes extensive music examples, original manuscript scores, and glimpses into the creative process from the composer."
722,722,https://d1w7fb2mkkr3kw.cloudfront.net/assets/images/book/mid/9780/7522/9780752266251.jpg,The Poldark Colouring Book,Poldark,Paperback,4.5,11.44,$,12.4,9780752266251,Stationery,dataset/Stationery/0000723.jpg,"The ultimate gift for any fan of the hit PBS series POLDARK starring Aidan Turner and Eleanor Tomlinson Be transported to the wild beauty of Cornwall as Ross Poldark returns home after the American Revolutionary War! The Official Poldark Coloring Book gives Poldark fans the chance to enjoy the characters and setting they have come to love in a more dynamic way than ever before. With 45 images from the TV series rendered in beautiful line art just waiting to be filled with color, this coloring book provides a Poldark experience unlike any other."
723,723,https://d1w7fb2mkkr3kw.cloudfront.net/assets/images/book/mid/9781/5947/9781594743245.jpg,Walls Notebook,Sherwood Forlee,Diary,4.0,13.75,$,17.0,9781594743245,Stationery,dataset/Stationery/0000724.jpg,"I'M Walls Doing Walls Things Lined journal Gift, 120 pages, Birthday gifts for Women, Perfect Notebook Gift for Walls 120 pages 6 x 9 Perfect size for all purposes"
724,724,https://d1w7fb2mkkr3kw.cloudfront.net/assets/images/book/mid/9788/8661/9788866134251.jpg,Moleskine Pebble Grey Plain Cahier Large Journal (3 Set),Moleskine,Diary,5.0,14.33,$,,9788866134251,Stationery,dataset/Stationery/0000725.jpg,"NATIONAL BESTSELLER SHORTLISTED for the 2022 Rakuten Kobo Emerging Writer Prize A GLOBE AND MAIL BEST BOOK OF THE YEAR ""Unreconciled is one hell of a good book. Jesse Wente’s narrative moves effortlessly from the personal to the historical to the contemporary. Very powerful, and a joy to read."" —Thomas King, author of The Inconvenient Indian and Sufferance A prominent Indigenous voice uncovers the lies and myths that affect relations between white and Indigenous peoples and the power of narrative to emphasize truth over comfort. Part memoir and part manifesto, Unreconciled is a stirring call to arms to put truth over the flawed concept of reconciliation, and to build a new, respectful relationship between the nation of Canada and Indigenous peoples. Jesse Wente remembers the exact moment he realized that he was a certain kind of Indian--a stereotypical cartoon Indian. He was playing softball as a child when the opposing team began to war-whoop when he was at bat. It was just one of many incidents that formed Wente's understanding of what it means to be a modern Indigenous person in a society still overwhelmingly colonial in its attitudes and institutions. As the child of an American father and an Anishinaabe mother, Wente grew up in Toronto with frequent visits to the reserve where his maternal relations lived. By exploring his family's history, including his grandmother's experience in residential school, and citing his own frequent incidents of racial profiling by police who'd stop him on the streets, Wente unpacks the discrepancies between his personal identity and how non-Indigenous people view him. Wente analyzes and gives voice to the differences between Hollywood portrayals of Indigenous peoples and lived culture. Through the lens of art, pop culture, and personal stories, and with disarming humour, he links his love of baseball and movies to such issues as cultural appropriation, Indigenous representation and identity, and Indigenous narrative sovereignty. Indeed, he argues that storytelling in all its forms is one of Indigenous peoples' best weapons in the fight to reclaim their rightful place. Wente explores and exposes the lies that Canada tells itself, unravels ""the two founding nations"" myth, and insists that the notion of ""reconciliation"" is not a realistic path forward. Peace between First Nations and the state of Canada can't be recovered through reconciliation--because no such relationship ever existed."
725,725,https://d1w7fb2mkkr3kw.cloudfront.net/assets/images/book/mid/9781/7867/9781786781291.jpg,Every Day Matters 2019 Pocket Diary,Dani Dipirro,Paperback,0.0,6.74,$,8.8,9781786781291,Stationery,dataset/Stationery/0000726.jpg,"The Pocket Field Guide for Disaster Health Professionals: Missioncraft in Disaster Relief is a disaster management toolkit containing briefing checklists, systems profiles, assessment forms, reporting templates, project management worksheets, and other tools required in the field. It also provides mission-critical technical reference information adapted from internationally recognized sources. “Missioncraft” is the art and science of preparing and conducting effective field operations. This Field Guide enables disaster health professionals to collect and analyze critical information and then implement high-impact interventions in field settings. Tools and reference information are structured in a concise, comprehensive, structured format. Sections are arranged in logical order of relief operations to facilitate application in key field activities. These activities include: Field briefing Field assessment Field recommendations Field reporting Field project and staff management Medical coordination The Pocket Field Guide for Disaster Health Professionals is an authoritative resource for field-based clinical and public health providers responsible for health outcomes of disaster-affected populations; team leaders and medical coordinators in governmental, non-governmental, Red Cross, and UN agencies; information and program staff supporting technical best practices in relief operations; and, trainers preparing health professionals for field missions."
726,726,https://d1w7fb2mkkr3kw.cloudfront.net/assets/images/book/mid/9781/6166/9781616612573.jpg,The Lord of the Rings,Ffg,Cards,0.0,10.93,$,12.36,9781616612573,Stationery,dataset/Stationery/0000727.jpg,"Frodo Baggins, bearer of the Ring of Power that would enable the evil Sauron to destroy all that is good in Middle-earth, takes on the task of carrying the Ring to Mount Doom to oversee its destruction. A new cover features artwork from the upcoming film adaptation of ""The Lord of the Rings: The Fellowship of the Ring, "" starring Elijah Wood, Sir Ian McKellen, Cate Blanchett, and Liv Tyler, scheduled for release in December. Copyright © Libri GmbH. All rights reserved."
727,727,https://d1w7fb2mkkr3kw.cloudfront.net/assets/images/book/mid/9780/8807/9780880799652.jpg,Halloween Tarot Deck,Kipling West,Cards,4.5,15.76,$,22.5,9780880799652,Stationery,dataset/Stationery/0000728.jpg,"Let the spooky citizens of Halloween Town guide your tarot practice with this sumptuously illustrated tarot deck inspired by Tim Burton’s classic animated film The Nightmare Before Christmas. Disney’s iconic holiday film The Nightmare Before Christmas is now an enchanting tarot set, offering a frightful-but-friendly take on the traditional 78-card deck. This set features all your favorite characters from Jack Skellington to Mr. Oogie Boogie to Sandy Claws himself in gorgeous original illustrations based on classic tarot iconography. Featuring both major and minor arcana, the set also comes with a helpful guidebook explaining each card’s meaning, as well as simple spreads for easy readings. Packaged in a sturdy, decorative gift box, this hauntingly charming tarot deck is the perfect gift for the The Nightmare Before Christmas fan or tarot enthusiast in your life."
728,728,https://d1w7fb2mkkr3kw.cloudfront.net/assets/images/book/mid/9780/4862/9780486297859.jpg,Pride and Prejudice Paper Dolls,Brenda Sneathen Mattox,Paperback,4.5,8.19,$,,9780486297859,Stationery,dataset/Stationery/0000729.jpg,"Bring Jane Austen's famous novel to life with 8 dolls and 48 period costumes for church, afternoon teas, weekend visits, neighborhood balls, and a wedding."
729,729,https://d1w7fb2mkkr3kw.cloudfront.net/assets/images/book/mid/9781/4549/9781454921462.jpg,The Thoth Tarot Book and Cards Set,Aleister Cowley,Mixed media product,3.5,17.72,$,23.5,9781454921462,Stationery,dataset/Stationery/0000730.jpg,"A new kit featuring one of the world's most popular tarot decks! The Thoth Tarot was the result of five years of painstaking effort by legendary occultist Aleister Crowley. This kit contains everything a reader of the Thoth Tarot might need: an authoritative 96-page book from authorities Johannes Fiebig and Evelin Burger and 80 cards with 24 reinterpretations of the major arcana and 56 of the minor arcana, including 3 versions of the Magus card, all painted with flaming intensity and rich in symbolism."
730,730,https://d1w7fb2mkkr3kw.cloudfront.net/assets/images/book/mid/9781/4889/9781488933011.jpg,Kaleidoscope Sticker Mosaics: Neon Nature,Hinkler Books,Book,3.5,13.72,$,,9781488933011,Stationery,dataset/Stationery/0000731.jpg,"A fresh and modern approach to a traditional idea Mosaic Sticker Book includes over 3000 geometrically-shaped stickers, which can be used to complete the gloriously colourful and patterned pages. This fun-filled sticker book provides hours of absorbing activity. Not suitable for children under 36 months because of small parts."
731,731,https://d1w7fb2mkkr3kw.cloudfront.net/assets/images/book/mid/9780/4864/9780486409702.jpg,Unicorns Stained Glass Colouring BO,Marty Noble,Paperback,3.0,2.81,$,,9780486409702,Stationery,dataset/Stationery/0000732.jpg,"The mythical, horse-like creature with a single horn in the middle of its forehead is celebrated in this beautifully illustrated coloring book. Thirty lovely illustrations show this fabulous animal carrying a young knight into battle, posing with a beautiful maiden, as sea serpents with fins, and much more. Descriptive captions."
732,732,https://d1w7fb2mkkr3kw.cloudfront.net/assets/images/book/mid/9781/9122/9781912213399.jpg,The Lost Words 20 Postcard Pack,Robert Macfarlane,Cards,4.5,11.54,$,14.5,9781912213399,Stationery,dataset/Stationery/0000733.jpg,"The Lost Words by composer James Burton takes its inspiration and text from the award-winning 'cultural phenomenon' and book of the same name by Robert Macfarlane and Jackie Morris: a book that was, in turn, a creative response to the removal of everyday nature words like acorn, newt and otter from a new edition of a widely used children's dictionary. Both the book and Burton's 32-minute work, which is written in 12 short movements for upper-voice choir in up to 3 voice parts (with either orchestral or piano accompaniment), celebrates each lost word with a beautiful poem or 'spell', magically brought to life in Burton's music. At its heart, the work delivers a powerful message about the need to close the gap between childhood and the natural world. Burton's piece was co-commissioned by the Hallé Concerts Society for the Hallé Children's Choir and the Boston Symphony Orchestra. The piano accompaniment version was premiered at the Tanglewood Festival in 2019 by the Boston Symphony Children's Choir, of which Burton is founder and director. The Hallé Children's Choir will premiere the orchestral version of the full work in Manchester, UK, post-pandemic. Vocal Score Co-commission by Boston Symphony and Hallé Concerts Society for their respective Children's Choirs. Two versions - with orchestral or with piano accompaniment. The vocal score is the same for both versions. James Burton is a composer but also a conductor. He is conductor of the Tanglewood Festival Chorus and choral director of the Boston Symphony. The book The Lost Words, exquisitely designed, has won multiple awards and is an international best-seller. The vocal score includes Jackie Morris's beautiful imagery in its cover design."
733,733,https://d1w7fb2mkkr3kw.cloudfront.net/assets/images/book/mid/9781/6165/9781616595944.jpg,Dragon Age,Dark Horse Deluxe,Game,3.0,6.74,$,7.5,9781616595944,Stationery,dataset/Stationery/0000734.jpg,"Prolific dwarven author and heroic companion of the Dragon Age games, Varric Tethras brings us the collected edition of his breakthrough crime-noir drama, Hard in Hightown (with help from his trusted human confidante, Mary Kirby)! This volume is beautifully illustrated by Stefano Martino, Álvaro Sarraseca, Andres Ponce, and Ricardo German Ponce Torres, with a painted cover by E.M. Gist! Twenty years of patrols have chiseled each and every stone of the Kirkwall streets into city guardsmen Donnen Brennokovic. Weary and weathered, Donnen is paired with a recruit so green he might as well have leaves growing out of his armor. When the mismatched pair discover a dead magistrate bleeding out on the flagstones, they're caught up in a clash between a shadowy organization known only as the Executors and a secretive group of Chantry agents--all over some ancient artifact. This is a prose novel featuring 24 black And white full page images."
734,734,https://d1w7fb2mkkr3kw.cloudfront.net/assets/images/book/mid/9781/4019/9781401954703.jpg,Notes from the Universe on Love & Connection,Mike Dooley,Cards,4.5,13.14,$,17.0,9781401954703,Stationery,dataset/Stationery/0000735.jpg,"The New York Times bestselling author of Infinite Possibilities brings “his signature wisdom, wit, and warmth” (Mike Robbins, author of Nothing Changes Until You Do) to this inspirational collection based on his bestselling Notes from the Universe trilogy, featuring a new foreword, introduction, and fresh, invaluable truths. For the first time ever, the hugely popular Notes from the Universe trilogy is presented in one volume, making it even easier to share the love and wisdom of Mike Dooley’s Universe. Since 2000, Mike Dooley has created empowering and positive affirmations to remind us that we have power over our lives and a say in our destiny. In order to bring about change, we must simply ask and show up. His insights can help you harness the metaphysical laws of the Universe so that you can be swept off your feet and carried along, as divine intelligence puts the right people in your path at just the right time. Soon you can find yourself living in a physical world that mirrors the life you thought could only exist in dreams. Now, you can discover fresh and inspirational notes in this ultimate volume, spread goodwill, and bring happiness and hope to your everyday life."
735,735,https://d1w7fb2mkkr3kw.cloudfront.net/assets/images/book/mid/9781/6168/9781616897147.jpg,"Observe, Collect, Draw! a Visual Journal",Giorgia Lupi,Hardback,4.5,14.34,$,18.0,9781616897147,Stationery,dataset/Stationery/0000736.jpg,"A guided journal with a fresh approach to the trendof journal-as-tool-for-self-examination. The journal is delightfully illustrated in the authors' trademark style-- accessible, whimsical, detailed. Blending inspiring examples with engaging instruction, this journal asks: What do we learn about ourselves when we measure our gratitude, confidence, and distraction levels? What do our collections say about who we are: our books, music, the clothes we wear? Observe, Collect, Draw! functions as a mini-course in information design, as accessible to beginners as it is engaging to seasoned info designers."
736,736,https://d1w7fb2mkkr3kw.cloudfront.net/assets/images/book/mid/9780/3807/9780380725724.jpg,Changing for Good,James O. Prochaska,Paperback,4.0,13.41,$,15.0,9780380725724,Stationery,dataset/Stationery/0000737.jpg,"The most beneficial school improvements are the ones that last. This book offers strategies for sustaining improvement by creating a shared vision, distributing leadership, and celebrating gains."
737,737,https://d1w7fb2mkkr3kw.cloudfront.net/assets/images/book/mid/9780/3995/9780399582257.jpg,Pop Manga Mermaids and Other Sea Creatures,Camilla D'Errico,Paperback,4.5,15.33,$,18.0,9780399582257,Stationery,dataset/Stationery/0000738.jpg,"An easy-to-follow, step-by-step manga drawing instruction book from fan favorite manga artist and painter Camilla d'Errico, featuring 30 lessons on illustrating cute, cool, and quirky characters in the Pop Surrealist style with pencils. With wildly popular appearances at Comic Cons and her paintings displayed in art galleries around the world, Camilla d'Errico has established herself as a go-to resource for manga-influenced art. Following in the footsteps of her past art instruction books Pop Manga and Pop Painting, Pop Manga Drawing provides the most direct and accessible lessons yet for rendering characters in her signature Pop Surrealist style. Written in the fun and encouraging voice that fans have come to expect, Pop Manga Drawing takes you step-by-step through lessons on drawing with graphite and mechanical pencils, along with insights on enhancing pieces with other mediums (including acrylics, markers, and colored pencils). It also provides tips and expert advice on drawing specific elements, including hair, eyes, and animals, that can take your manga art to the next level. Pop Manga Drawing grants one-of-a-kind access to the basic building blocks of artistic expression, giving you the tools you need to create your own pop manga masterpieces."
738,738,https://d1w7fb2mkkr3kw.cloudfront.net/assets/images/book/mid/9780/9641/9780964126206.jpg,Children's Travel Journal,Ann Banks,Hardback,4.0,15.53,$,22.5,9780964126206,Stationery,dataset/Stationery/0000739.jpg,"Kids Travel Journal: My Travel Diary for Australia Is your family planning an adventure through Australia? Then give your kids a fun travel journal to engage their minds and collect their vacation memories for a lifetime. Have you ever found your kids bored on a family trip? Wouldn't it be great to offer them something other than a video game to keep them occupied? This travel journal for kids is a perfect vacation buddy that offers prompts to really trigger their imagination. Imagine how much fun your kids will have filling out their travel diary with prompts that ask them to draw and write about the experieces in Australia. They can share their memories of the Sydney Opera House or the Great Barrier Reef. And for those younger travelers, there's plenty of ""Check the Box"" type questions and simple fill in the blank questions that mom and dad can easily share in the fun. Plus this travel diary also comes with travel games for kids like hangman, tic tac toe and more. It's perfect for early writers and kids on the verge on writing. Here's what your kids will love best: • Log the places they have traveled throughout Australia • Fill in the blank travel pages like: My Passport, Our Vacation Itinerary • Free doodle pages to draw their favorite moments of the trip • Log and rate their experiences with new foods • Collect all their tickets in their scrap pages This kids travel journal includes much much more including my packing check list, get to know the flag of Australia, my five senses and other travel activities for kids. So pick it up today and get started by clicking the button above. Most commonly suited for children ages 4 - 7. Page Count: 100 PagesBinding: Trade PaperSize: 8.5"" x 11""Language: EnglishColor: Full Color Cover / Black & White Interior"
