,Unnamed: 0,image,name,author,format,book_depository_stars,price,currency,old_price,isbn,category,img_paths,description
481,481,https://d1w7fb2mkkr3kw.cloudfront.net/assets/images/book/mid/9781/6166/9781616612603.jpg,Lord of the Rings Lcg,Fantasy Flight Games,Game,0.0,10.38,$,12.36,9781616612603,Stationery,dataset/Stationery/0000482.jpg,"The Companions of the Ring have become involved in separate adventures as the quest continues. Aragorn, revealed as the hidden heir of the ancient Kings of the West, joined with the Riders of Rohan against the forces of Isengard, and took part in the desperate victory of the Hornburg. Merry and Pippin, captured by orcs, escaped into Fangorn Forest and there encountered the Ents. Gandalf returned, miraculously, and defeated the evil wizard, Saruman. Meanwhile, Sam and Frodo progressed towards Mordor to destroy the Ring, accompanied by Smagol - Gollum, still obsessed by his 'preciouss'. After a battle with the giant spider, Shelob, Sam left his master for dead; but Frodo is still alive - in the hands of the orcs. And all the time the armies of the Dark Lord are massing. JRR Tolkien's great work of imaginative fiction has been labelled both a heroic romance and a classic fantasy fiction. By turns comic and homely, epic and diabolic, the narrative moves through countless changes of scene and character in an imaginary world which is totally convincing in its detail."
482,482,https://d1w7fb2mkkr3kw.cloudfront.net/assets/images/book/mid/9781/7862/9781786272515.jpg,Ocean Bingo,Holly Exley,Hardback,0.0,21.81,$,24.0,9781786272515,Stationery,dataset/Stationery/0000483.jpg,"This beautifully illustrated bingo game features 64 species of birds from around the world. Spot all kinds of birds—from the robin to the puffin and the kookaburra to the splendid fairywren—mark them off on your card and bingo! Contains 64 superbly illustrated bird tokens, one board, 12 bingo cards, and brightly colored counters for you to mark up your card, as well as a leaflet containing basic information and a few quirky traits for all of the birds featured."
483,483,https://d1w7fb2mkkr3kw.cloudfront.net/assets/images/book/mid/9780/4864/9780486413600.jpg,Monet Notebook,Claude Monet,Paperback,0.0,3.59,$,,9780486413600,Stationery,dataset/Stationery/0000484.jpg,"Practice your strokes in the garden with this lovely notebook inspired by Claude Monet’s artwork and words. Claude Monet was famous for his dedication and consistent practice of Impressionist artwork, often painting the same scene many times from every angle. Now you, too, can capture the perfect moment in a sketch, a doodle, or simply a phrase, in the Claude Monet Notebook, complete with quotes and facsimiles from the painter himself. Sketch away the days, as Monet did, and record everything that inspires you on the blank pages of this perfect little notebook."
484,484,https://d1w7fb2mkkr3kw.cloudfront.net/assets/images/book/mid/9780/8118/9780811874120.jpg,New York - City Walks,Christina Henry de Tessan,Cards,4.5,10.47,$,12.5,9780811874120,Stationery,dataset/Stationery/0000485.jpg,
485,485,https://d1w7fb2mkkr3kw.cloudfront.net/assets/images/book/mid/9781/6332/9781633223417.jpg,Creative Lettering and Beyond Art & Stationery Kit,Gabri Joy Kirkendall,Mixed media product,4.0,12.63,$,14.5,9781633223417,Stationery,dataset/Stationery/0000486.jpg,"With more than 50 tips, techniques, and lessons for creating beautiful illuminated letters and sophisticated lettering projects, The Joy of Lettering takes hand lettering to a whole new level. Gabri Joy Kirkendall (Creative Lettering & Beyond) and Jaclyn Escalera guide readers through a dynamic exploration of the craft, focusing on typography and illuminated letters and numbers using pencil, ink, and marker in a variety of styles and themes. From there, artists will learn how to create letters using a variety of alternative materials and media, such as watercolor, gouache, and wood. Easily customized DIY projects invite artists to finesse their skills as they learn to letter on different types of surfaces while creating lettered murals, stationery, and signage. Packed with creative techniques and easy-to-follow lessons, this all-inclusive resource is a must??have for anyone who wants to learn or grow their expertise in the art of hand lettering."
486,486,https://d1w7fb2mkkr3kw.cloudfront.net/assets/images/book/mid/9780/7624/9780762464418.jpg,Fantastic Beasts: The Magizoologist's Discovery Case,Donald Lemke,Mixed media product,5.0,32.01,$,43.5,9780762464418,Stationery,dataset/Stationery/0000487.jpg,"Fantastic Beasts and Where to Find Them takes fans to a new era in J.K. Rowling's Wizarding World, decades before Harry Potter and half a world away. Inspired by the Hogwarts textbook, Fantastic Beasts and Where to Find Them, written by J.K. Rowling's character, Newt Scamander, the film follows a magical mix-up that takes Newt on a chase around New York City looking for the magical creatures that have escaped from his case. This kit contains a collectible miniature replica of Newt's leather case, complete with sound and hand movement of the Niffler, along with a 48-page book of short profiles of Newt and the beasts and full-color imagery from the film."
487,487,https://d1w7fb2mkkr3kw.cloudfront.net/assets/images/book/mid/9781/4521/9781452115573.jpg,Travel Listography,Lisa Nola,Calendar,4.5,13.19,$,17.0,9781452115573,Stationery,dataset/Stationery/0000488.jpg,"A stylish and helpful journal designed specifically for female travelers. The perfect traveling companion, EVERYWOMAN'S TRAVEL JOURNAL is newly redesigned for the savvy and reflective adventurer. It includes lined and blank pages for journaling and sketching, with handy information tailored for women travelers on security, dress, and natural remedies that combat common travel ailments. Lists and tips on packing, shopping, etiquette, and avoiding jet lag round out this conveniently portable journal, and an inside pocket holds postcards, receipts, mementos, and documents for safekeeping. Filled with traveling advice no woman should leave home without, EVERYWOMAN'S TRAVEL JOURNAL is both useful and inspirational."
488,488,https://d1w7fb2mkkr3kw.cloudfront.net/assets/images/book/mid/9780/7624/9780762431908.jpg,Penguin Bowling,Rebecca McCarthy,Mixed media product,0.0,6.02,$,7.99,9780762431908,Stationery,dataset/Stationery/0000489.jpg,"Twin Peaks meets Welcome to Night Vale in this surreal, supernatural thriller by a Costa-shortlisted author ""Gripping, compelling and otherworldly"" DAVID QUANTICK When her twin brother goes missing in Northern California, Vivian Owens follows his trail to the town of Mount Hookey, home to the followers of Telos: a mountain-worshipping cult that offers spiritual fulfilment to those who seek it. While trying to navigate the town’s bizarre inhabitants and the seductive preaching of the initiates of Telos, Vivian will have to confront questions about herself, her family, and everything she thinks she knows about the world. She quickly realises that her search is about far more than her missing brother – it is a quest for the secret of happiness itself. To that end, there is only one question she needs to answer: what is really at the top of Mount Hookey?"
489,489,https://d1w7fb2mkkr3kw.cloudfront.net/assets/images/book/mid/9781/4197/9781419730146.jpg,Art: 365 Days of Masterpieces 2019 Desk Calendar,Metropolitan Museum of Art,Calendar,0.0,17.79,$,,9781419730146,Stationery,dataset/Stationery/0000490.jpg,"Explore Europe's top 100 works of art with America's most trusted travel authority, Rick Steves. Travel through time and discover Europe's most iconic paintings, sculptures, and historic buildings. From Venus to Versailles, Apollo to David, and Mona Lisa to The Thinker, Rick and co-author Gene Openshaw will have you marveling, learning, and laughing, one masterpiece at a time. Whether you're traveling to Europe or just dreaming about it, this book both stokes your wanderlust and kindles a greater appreciation of art, with historical context and information on where to see it for yourself. With Rick's trusted insight and gorgeous, full-color photos throughout, Europe's Top 100 Masterpieces celebrates nearly 20,000 years of unforgettable art."
490,490,https://d1w7fb2mkkr3kw.cloudfront.net/assets/images/book/mid/9781/7436/9781743678695.jpg,Baby Record Book rework (blue),Hinkler Books,Book,0.0,13.4,$,,9781743678695,Stationery,dataset/Stationery/0000491.jpg,
491,491,https://d1w7fb2mkkr3kw.cloudfront.net/assets/images/book/mid/9788/8837/9788883701658.jpg,Moleskine Large Address-book Black,Moleskine,Notebook / blank book,0.0,13.06,$,18.9,9788883701658,Stationery,dataset/Stationery/0000492.jpg,
492,492,https://d1w7fb2mkkr3kw.cloudfront.net/assets/images/book/mid/9780/8118/9780811849555.jpg,Art of Pixar Animation Studios Postcards,Disney - Pixar,Postcard book or pack,4.5,18.93,$,19.1,9780811849555,Stationery,dataset/Stationery/0000493.jpg,"From Ratatouille through Brave, The Art of Pixar: Volume II features gorgeous and illuminating concept art and iconic final frames from the 6 Pixar feature films and 18 short films released from 2007 on."
493,493,https://d1w7fb2mkkr3kw.cloudfront.net/assets/images/book/mid/9780/4864/9780486424118.jpg,Twelve Van Gogh Bookmarks,Vincent Van Gogh,Paperback,0.0,2.81,$,,9780486424118,Stationery,dataset/Stationery/0000494.jpg,"Enchanting markers include details from 12 of the famed French artist's finest paintings, among them Dancer at the Bar; Frieze of Dancers; Dancer with Bouquet, Curtseying, and 9 others."
494,494,https://d1w7fb2mkkr3kw.cloudfront.net/assets/images/book/mid/8058/3417/8058341717684.jpg,"Moleskine Ltd. Edition Notebook, Harry Potter, Marauder's Map, Large, Ruled, Hard Cover (5 X 8.25)",Moleskine,Diary,0.0,15.71,$,25.24,8058341717684,Stationery,dataset/Stationery/0000495.jpg,
495,495,https://d1w7fb2mkkr3kw.cloudfront.net/assets/images/book/mid/9781/6166/9781616618605.jpg,The Lord of the Rings Lcg,,Game,0.0,10.24,$,13.5,9781616618605,Stationery,dataset/Stationery/0000496.jpg,"Frodo Baggins, bearer of the Ring of Power that would enable the evil Sauron to destroy all that is good in Middle-earth, takes on the task of carrying the Ring to Mount Doom to oversee its destruction. A new cover features artwork from the upcoming film adaptation of ""The Lord of the Rings: The Fellowship of the Ring, "" starring Elijah Wood, Sir Ian McKellen, Cate Blanchett, and Liv Tyler, scheduled for release in December. Copyright © Libri GmbH. All rights reserved."
496,496,https://d1w7fb2mkkr3kw.cloudfront.net/assets/images/book/mid/9781/7436/9781743678701.jpg,Baby Record Book rework (yellow),Hinkler Books,Book,0.0,8.44,$,,9781743678701,Stationery,dataset/Stationery/0000497.jpg,
497,497,https://d1w7fb2mkkr3kw.cloudfront.net/assets/images/book/mid/9789/9004/9789900493433.jpg,Bible Tab,Tabbies,Paperback,5.0,3.65,$,,9789900493433,Stationery,dataset/Stationery/0000498.jpg,"Put each of the books in the Bible at your fingertips. A total of 84 elegant foil-edged tabs are designed for Old and New Testaments, as well as tabs for additional books found in the Catholic Bible. Also includes a selection of special tabs for marking your own Life Verse, concordance, and more. Design derived from The Psalter in the German Translation of Martin Luther."
498,498,https://d1w7fb2mkkr3kw.cloudfront.net/assets/images/book/mid/9780/7387/9780738707907.jpg,Golden Tarot of Klimt Cards,Lo Scarabeo,Cards,3.5,25.68,$,31.5,9780738707907,Stationery,dataset/Stationery/0000499.jpg,"In twentieth century Vienna, the art of Gustav Klimt held a primary position. Inspired by this modern master, these cards are teeming with impressions-stamped in gold- that recount love, death, sensuality, and regeneration. This deluxe edition also includes an embroidered satin bag and instructions-all encased in a box sized to fit snugly on a book shelf. Publisher Review: The art of Gustav Klimt (1862–1918), filled with symbolism, passion and eroticism, have become so popular that they appear everywhere, from posters on college student's walls to coffee mugs, from stained glass imitations to ceramic tile. His piece, ""The Kiss,"" is virtually iconic and his painting of Adele Bloch-Bauer sold for $135 million in 2006, the highest price ever for a painting. Klimt combined graphic techniques with pictorial ones, flaunting conventions of the time, perhaps in anticipation of Weimar Germany that began a year after his death. Besides his mastery of inventive art [read more]"
499,499,https://d1w7fb2mkkr3kw.cloudfront.net/assets/images/book/mid/9788/8673/9788867323067.jpg,Moleskine Extra Large Ruled Notebook Hard Black,Moleskine,Notebook / blank book,5.0,16.32,$,23.5,9788867323067,Stationery,dataset/Stationery/0000500.jpg,
500,500,https://d1w7fb2mkkr3kw.cloudfront.net/assets/images/book/mid/9780/0999/9780099978800.jpg,No Roses For Harry,Gene Zion,Paperback,4.5,8.89,$,10.3,9780099978800,Stationery,dataset/Stationery/0000501.jpg,"Harry, the spotted dog, finds that it is almost impossible to lose a gift sweater that he does not want"
501,501,https://d1w7fb2mkkr3kw.cloudfront.net/assets/images/book/mid/9781/5728/9781572811225.jpg,Tiny Universal Waite Tarot Deck,Arthur Edward Waite,Mixed media product,3.5,6.39,$,9.5,9781572811225,Stationery,dataset/Stationery/0000502.jpg,"Now available as the world's smallest tarot deck, this pack of universal Waite tarot uses the drawings of Patricia Colman Smith, recoloured by Mary Hanson-Roberts."
502,502,https://d1w7fb2mkkr3kw.cloudfront.net/assets/images/book/mid/9780/7387/9780738747583.jpg,Ceccoli Tarot Mini,Nicoletta Ceccoli,Cards,4.5,10.64,$,13.0,9780738747583,Stationery,dataset/Stationery/0000503.jpg,
503,503,https://d1w7fb2mkkr3kw.cloudfront.net/assets/images/book/mid/9781/5233/9781523312696.jpg,Swear Word Coloring Book,Adult Coloring World,Paperback,4.0,11.49,$,,9781523312696,Stationery,dataset/Stationery/0000504.jpg,"This Swear Word Coloring Book Contains Over 100 Pages 50 swear words to color Single sided designs for you to color whenever you need a boost of confidence or a not so gentle reminder of how badass you are, with Hilarious uncensored expletives, graphics, and phrases. * It measures 8.5x11 with book industry perfect binding, a sturdy matte cover, and white pages that are great for pencil, crayon, gel pens or markers. * Designs are printed only on one side of each sheet of paper to prevent bleedthrough. Click on our name ""Maeve Coloring Books"" located under the title of this listing for more swear word coloring books!"
504,504,https://d1w7fb2mkkr3kw.cloudfront.net/assets/images/book/mid/9788/8837/9788883705069.jpg,Moleskine Plain Cahier Xl - Black Cover (3 Set),Moleskine,Paperback,5.0,13.64,$,15.9,9788883705069,Stationery,dataset/Stationery/0000505.jpg,"""A cheeky take on the afterlife brimming with sass, angst, and heart."" --Christine Riccio, New York Times bestselling author of Again, but Better. Beatrice Fox deserves to go straight to hell. At least, that's what she believes. Her last day on Earth, she ruined the life of the person she loves most--her little sister, Emmy. So when Bea awakens from a fatal car accident to find herself on an airplane headed who knows where, she's confused, to say the least. Once on the ground, Bea receives some truly harrowing news: she's in purgatory. If she ever wants to catch a flight to heaven, she'll have to help five thousand souls figure out what's keeping them from moving on. But one of Bea's first assignments is Caleb, the boy who caused her accident, and the last person Bea would ever want to send to the pearly gates. And as much as Bea would love to see Caleb suffer for dooming her to a seemingly endless future of eating bad airport food and listening to other people's problems, she can't help but notice that he's kind of cute, and sort of sweet, and that maybe, despite her best efforts, she's totally falling for him. From debut author Gabby Noone comes a darkly hilarious and heartfelt twist on the afterlife about finding second chances, first loves, and new friendships in the most unlikely places."
505,505,https://d1w7fb2mkkr3kw.cloudfront.net/assets/images/book/mid/9780/8118/9780811877565.jpg,Pantone,Eiseman Recker,Hardback,4.0,28.08,$,36.0,9780811877565,Stationery,dataset/Stationery/0000506.jpg,"Using the Pantone color identification system, an artful first colors book introduces children to nine basic colors and twenty shades of each, illustrating the concept of one color name referring to a variety of dark, light, and in-between tones."
506,506,https://d1w7fb2mkkr3kw.cloudfront.net/assets/images/book/mid/9781/4232/9781423220695.jpg,Blank,Inc. Barcharts,Cards,0.0,12.89,$,,9781423220695,Stationery,dataset/Stationery/0000507.jpg,"Integer Algorithms in Cryptology and Information Assurance is a collection of the author's own innovative approaches in algorithms and protocols for secret and reliable communication. It concentrates on the “what” and “how” behind implementing the proposed cryptographic algorithms rather than on formal proofs of “why” these algorithms work.The book consists of five parts (in 28 chapters) and describes the author's research results in:This text contains innovative cryptographic algorithms; computationally efficient algorithms for information assurance; new methods to solve the classical problem of integer factorization, which plays a key role in cryptanalysis; and numerous illustrative examples and tables that facilitate the understanding of the proposed algorithms.The fundamental ideas contained within are not based on temporary advances in technology, which might become obsolete in several years. The problems addressed in the book have their own intrinsic computational complexities, and the ideas and methods described in the book will remain important for years to come."
507,507,https://d1w7fb2mkkr3kw.cloudfront.net/assets/images/book/mid/9781/6010/9781601067586.jpg,Knock Knock What I Love About Us Fill in the Blank Journal,Knock Knock,Notebook / blank book,5.0,6.21,$,9.0,9781601067586,Stationery,dataset/Stationery/0000508.jpg,
508,508,https://d1w7fb2mkkr3kw.cloudfront.net/assets/images/book/mid/9781/6088/9781608875610.jpg,Harry Potter Slytherin Hardcover Ruled Journal,Insight Editions,Hardback,5.0,11.44,$,20.5,9781608875610,Stationery,dataset/Stationery/0000509.jpg,Celebrate your love of the HARRY POTTER™ films with this beautiful journal featuring a stunning graphic of HOGWARTS’™ SLYTHERIN™ house. This journal lies flat when open and includes 192 ruled pages and a ribbon placeholder.
509,509,https://d1w7fb2mkkr3kw.cloudfront.net/assets/images/book/mid/9781/5712/9781571205339.jpg,Judith Baker Montano's Embroidery & Crazy Quilting Stitch Tool,Judith Montano,Spiral bound,4.5,19.34,$,22.5,9781571205339,Stationery,dataset/Stationery/0000510.jpg,"The fiber artist and author of Crazy Quilting Odyssey shares her secrets for creating embroidered landscapes and seascapes in this illustrated guide. Beloved fiber artist and teacher Judith Baker Montano demonstrates how to beyond traditional embroidery in this new and comprehensive to free-form embroidery. In this book full of stunningly photographed examples and watercolor illustrations, she shows you how to apply the principles of fine art to various projects using fabrics, threads, and fibers. Judith explains how to use these materials with other embellishments to convey lifelike trees, flowers, ocean corals, and more with 60 stitches and 67 stitch combinations. She also demonstrates artistic embroidery techniques for building layers, creating dimension and perspective, and blending shapes. With techniques of free-form embroidery, you’ll be able to translate your favorite landscape or seascape photo into fiber art."
510,510,https://d1w7fb2mkkr3kw.cloudfront.net/assets/images/book/mid/9788/8661/9788866134220.jpg,Moleskine Pebble Grey Plain Cahier Pocket Journal (3 Set),Moleskine,Diary,0.0,5.48,$,6.9,9788866134220,Stationery,dataset/Stationery/0000511.jpg,"NATIONAL BESTSELLER SHORTLISTED for the 2022 Rakuten Kobo Emerging Writer Prize A GLOBE AND MAIL BEST BOOK OF THE YEAR ""Unreconciled is one hell of a good book. Jesse Wente’s narrative moves effortlessly from the personal to the historical to the contemporary. Very powerful, and a joy to read."" —Thomas King, author of The Inconvenient Indian and Sufferance A prominent Indigenous voice uncovers the lies and myths that affect relations between white and Indigenous peoples and the power of narrative to emphasize truth over comfort. Part memoir and part manifesto, Unreconciled is a stirring call to arms to put truth over the flawed concept of reconciliation, and to build a new, respectful relationship between the nation of Canada and Indigenous peoples. Jesse Wente remembers the exact moment he realized that he was a certain kind of Indian--a stereotypical cartoon Indian. He was playing softball as a child when the opposing team began to war-whoop when he was at bat. It was just one of many incidents that formed Wente's understanding of what it means to be a modern Indigenous person in a society still overwhelmingly colonial in its attitudes and institutions. As the child of an American father and an Anishinaabe mother, Wente grew up in Toronto with frequent visits to the reserve where his maternal relations lived. By exploring his family's history, including his grandmother's experience in residential school, and citing his own frequent incidents of racial profiling by police who'd stop him on the streets, Wente unpacks the discrepancies between his personal identity and how non-Indigenous people view him. Wente analyzes and gives voice to the differences between Hollywood portrayals of Indigenous peoples and lived culture. Through the lens of art, pop culture, and personal stories, and with disarming humour, he links his love of baseball and movies to such issues as cultural appropriation, Indigenous representation and identity, and Indigenous narrative sovereignty. Indeed, he argues that storytelling in all its forms is one of Indigenous peoples' best weapons in the fight to reclaim their rightful place. Wente explores and exposes the lies that Canada tells itself, unravels ""the two founding nations"" myth, and insists that the notion of ""reconciliation"" is not a realistic path forward. Peace between First Nations and the state of Canada can't be recovered through reconciliation--because no such relationship ever existed."
511,511,https://d1w7fb2mkkr3kw.cloudfront.net/assets/images/book/mid/9781/6166/9781616615048.jpg,Elder Sign,,Game,0.0,19.7,$,22.53,9781616615048,Stationery,dataset/Stationery/0000512.jpg,"Five years ago the monstrous god Cthulhu awoke from his slumber under the sea, sending most of the world into madness. In the aftermath, terrifying creatures entered our world, a cult of human-sacrificing Cthulhu worshippers emerged, and humanity has struggled desperately to survive. Saeko, Dell, and Kelsea are three such survivors, who have lived in the underground bunker of Arkham since age 14."
512,512,https://d1w7fb2mkkr3kw.cloudfront.net/assets/images/book/mid/9781/6166/9781616615420.jpg,Descent Second Edition,,Game,0.0,45.93,$,63.49,9781616615420,Stationery,dataset/Stationery/0000513.jpg,
513,513,https://d1w7fb2mkkr3kw.cloudfront.net/assets/images/book/mid/9781/4197/9781419702709.jpg,Garbage Pail Kids,The Topps Company,Hardback,4.0,16.85,$,21.1,9781419702709,Stationery,dataset/Stationery/0000514.jpg,"Goosebumps creator R.L. Stine teams up with the pop-culture phenomenon Garbage Pail Kids for a first-ever GPK illustrated middle-grade series Welcome to the town of Smellville, where ten kids all live in a big tumbledown house and have as much fun as they possibly can. People may think that they’re gross and weird and strange, but they’re not bad kids—they just don’t know any better. In this hilarious new illustrated series from bestselling author R.L. Stine, the Garbage Pail Kids—from Adam Bomb to Brainy Janey—get into mischief at their middle school, all while battling bullies and their archenemies, Penny and Parker Perfect. These all-new illustrated stories are sure to amuse, entertain, and blow away readers of all ages. Bonus: includes four exclusive Garbage Pail Kids stickers!"
514,514,https://d1w7fb2mkkr3kw.cloudfront.net/assets/images/book/mid/9781/4521/9781452125480.jpg,Living Well One Line a Day,Chronicle Books,Calendar,3.5,12.92,$,17.0,9781452125480,Stationery,dataset/Stationery/0000515.jpg,"NATIONAL BESTSELLER • A stunning “portrait of the enduring grace of friendship” (NPR) about the families we are born into, and those that we make for ourselves. A masterful depiction of love in the twenty-first century. A NATIONAL BOOK AWARD FINALIST • A MAN BOOKER PRIZE FINALIST • WINNER OF THE KIRKUS PRIZE A Little Life follows four college classmates—broke, adrift, and buoyed only by their friendship and ambition—as they move to New York in search of fame and fortune. While their relationships, which are tinged by addiction, success, and pride, deepen over the decades, the men are held together by their devotion to the brilliant, enigmatic Jude, a man scarred by an unspeakable childhood trauma. A hymn to brotherly bonds and a masterful depiction of love in the twenty-first century, Hanya Yanagihara’s stunning novel is about the families we are born into, and those that we make for ourselves. Look for Hanya Yanagihara’s new novel, To Paradise, coming in January 2022."
