,Unnamed: 0,image,name,author,format,book_depository_stars,price,currency,old_price,isbn,category,img_paths,description
247,247,https://d1w7fb2mkkr3kw.cloudfront.net/assets/images/book/mid/9781/9316/9781931686990.jpg,The Housewives Tarot,Jude Buffum,Cards,4.5,14.14,$,18.5,9781931686990,Stationery,dataset/Stationery/0000248.jpg,"Within This Box Lie The Secrets of Domestic Empowerment Begin your journey by lifting the lid, dealing out your fate, and understanding the hidden messages of The Housewives Tarot. Through images of dinnerware (Pentacles), martini glasses (Cups), mops and brooms (Wands), and much more, these tarot cards can answer all of life's most challenging questions. The enclosed instruction book will show you how to interpret all 78 cards and provides useful advice on giving a reading. Includes: - 78-card Tarot Deck - Instruction Book"
248,248,https://d1w7fb2mkkr3kw.cloudfront.net/assets/images/book/mid/9781/6010/9781601066909.jpg,Knock Knock Why You`re My Bestie Fill in the Love Journal,Knock Knock,Notebook / blank book,3.5,6.21,$,9.0,9781601066909,Stationery,dataset/Stationery/0000249.jpg,
249,249,https://d1w7fb2mkkr3kw.cloudfront.net/assets/images/book/mid/9781/4521/9781452153827.jpg,Letters to My Daughter,Lea Redmond,Book,5.0,9.75,$,12.0,9781452153827,Stationery,dataset/Stationery/0000250.jpg,"NEW YORK TIMES BESTSELLER • Maya Angelou shares her path to living well and with meaning in this absorbing book of personal essays. Dedicated to the daughter she never had but sees all around her, Letter to My Daughter transcends genres and categories: guidebook, memoir, poetry, and pure delight. Here in short spellbinding essays are glimpses of the tumultuous life that led Angelou to an exalted place in American letters and taught her lessons in compassion and fortitude: how she was brought up by her indomitable grandmother in segregated Arkansas, taken in at thirteen by her more worldly and less religious mother, and grew to be an awkward, six-foot-tall teenager whose first experience of loveless sex paradoxically left her with her greatest gift, a son. Whether she is recalling such lost friends as Coretta Scott King and Ossie Davis, extolling honesty, decrying vulgarity, explaining why becoming a Christian is a “lifelong endeavor,” or simply singing the praises of a meal of red rice–Maya Angelou writes from the heart to millions of women she considers her extended family. Like the rest of her remarkable work, Letter to My Daughter entertains and teaches; it is a book to cherish, savor, re-read, and share. “I gave birth to one child, a son, but I have thousands of daughters. You are Black and White, Jewish and Muslim, Asian, Spanish speaking, Native Americans and Aleut. You are fat and thin and pretty and plain, gay and straight, educated and unlettered, and I am speaking to you all. Here is my offering to you.”—from Letter to My Daughter"
250,250,https://d1w7fb2mkkr3kw.cloudfront.net/assets/images/book/mid/9781/9254/9781925429275.jpg,Sacred Power Reading Cards,Anna Stark,Cards,5.0,11.71,$,21.6,9781925429275,Stationery,dataset/Stationery/0000251.jpg,"When you're born, you're given your own individual magical word—your name. It holds the keys to your soul's energies and abilities. If you come to know and use your name properly, you can uncover your soul's purpose, manifest abundance, and open up to unlimited possibilities. The Sacred Power in Your Name includes entries for nearly two hundred names with meanings, affirmations, sound and chakra elements, and meditations. Using the techniques and information in this book, you will be able to: Analyze the sounds and rhythms of your name Transform your name into a magical incantation Awaken creative energies related to your name Create an inner talisman Discover your purpose in life Use your name for empowerment and healing Your name is your direct link to the infinite possibilities of the universe. In this book, you will discover new worlds and wonders as you uncover the true power of your very own magical word. Praise: ""Ted explores the names themselves, and he goes into every nuance of naming. This is a very in-depth study of the sacred power of names.""—Phoenix McFarland, author of The New Book of Magical Names"
251,251,https://d1w7fb2mkkr3kw.cloudfront.net/assets/images/book/mid/9781/4521/9781452114224.jpg,Ticket Stub Diary,Eric Epstein,Diary,4.0,13.13,$,15.0,9781452114224,Stationery,dataset/Stationery/0000252.jpg,"Are you looking for Ticket Stub Organizer for you? Then you're in the right place! This Ticket Journal designed to helps to tracking your Collecting tickets, Collecting Tickets is a fun/hobby and passion and I hope you can enjoy this cute little way to keep organized! This awesome Ticket Stub Notebook features: A useful notebook for collectors of tickets in a convenient. This journal to keep track of all your collections. Whether its your concert, super bowl or movie going tickets. It contains: Ticket Date, Time Details of The Tickets Purchased/Found From History of the Ticket and more. Perfect Large size 8 x 10 inches, 110 pages. Printed on High Quality paper and Perfect binding Premium Glossy Finish Cover Design If you want more types of notebooks, you can Click on ""Author Name"" above this page (Author Page), We have a lot of Notebooks and Journals you will like! So, I hope you've decided to grab this, order your Journal Now! Thank you very much!"
252,252,https://d1w7fb2mkkr3kw.cloudfront.net/assets/images/book/mid/8053/8536/8053853600271.jpg,"Moleskine 2020 Petit Prince Daily Planner, 12m, Large, Planet, Hard Cover (5 X 8.25)",Moleskine,Calendar,0.0,15.75,$,27.04,8053853600271,Stationery,dataset/Stationery/0000253.jpg,"Antoine de Saint-Exupéry's The Little Prince remains one of the most treasured books of all time. This commemorative kit includes: 3"" light-up collectible of the Prince's cherished rose, set under a clear dome and on a base bearing the story's most famous quote: ""It is only with the heart that one can see rightly; what is essential is invisible to the eye."" 32-page book of quotes and full-color artwork from The Little Prince"
253,253,https://d1w7fb2mkkr3kw.cloudfront.net/assets/images/book/mid/9781/6088/9781608876860.jpg,Harry Potter: Hogwarts Deluxe Stationery Set,Warner Bros Consumer Products Inc,Hardback,5.0,27.92,$,38.0,9781608876860,Stationery,dataset/Stationery/0000254.jpg,"Send your own magical letters with this deluxe Harry Potter–themed Deathly Hallows stationery kit. Celebrate the artistry of the Harry Potter films with this Deathly Hallows–themed stationery set. The Elder Wand, the Resurrection Stone, and the Cloak of Invisibility—together these make up the Deathly Hallows. This deluxe collectible set includes a 192-page ruled journal, a wax stamp and two wax sticks, letter-writing paper, envelopes, and a paperweight—all of which feature the iconic Deathly Hallows symbol. Showcasing vibrant graphics and concept art from the beloved films, this finely crafted stationery set invites fans to imbue their everyday writing with magic."
254,254,https://d1w7fb2mkkr3kw.cloudfront.net/assets/images/book/mid/9780/8118/9780811878364.jpg,My Future Listography,Lisa Nola,Calendar,4.0,11.22,$,13.5,9780811878364,Stationery,dataset/Stationery/0000255.jpg,"A new twist on the bestselling Listography journal series (almost 900,000 titles sold), this game invites players to create and share lists based on fun and thought-provoking topics from geography and pop culture to toothpaste and constellations! With the goal of being the first around the game board, players score points according to the number of similar or unique answers. Every round in the game results in creative thinking, surprise outcomes, and lots of laughs."""
255,255,https://d1w7fb2mkkr3kw.cloudfront.net/assets/images/book/mid/9780/8807/9780880796866.jpg,The Original Rider Waite Tarot Pack,A.E. Waite,Cards,4.0,20.47,$,27.5,9780880796866,Stationery,dataset/Stationery/0000256.jpg,"You are meant to live with grace, style, wisdom, and boundless joy. With this unique book, you can set free your inner diva and let your fabulousity shine through every day! Putting a fun and fresh spin on the art of card reading, professional tarot reader Sasha Graham unveils the magic and mystery of a tarot deck. She shows that the tarot is much more than a deck of cards—it's a fantastic tool for embracing your beauty, unleashing your power, and enriching your life. For beginners and seasoned professionals alike, Tarot Diva teaches tarot basics and presents creative new ways to explore each card's particular energies: meditations, exercises, recipes, spells, charms, and even fashion tips. You'll weave enchantment through every aspect of your life...and discover the diva within. Manifest your wishes by casting powerful tarot spells Re-create delicious recipes that invoke tarot archetypes Peek into your future with divinatory spreads Create cool charms to channel your inner power Praise: ""What tarot needs—right now—is Sasha Graham.""—Rachel Pollack, award-winning author of 78 Degrees of Wisdom ""One of our star students, Sasha Graham, has filled us with pride and admiration with this sparkling new approach to teaching tarot. Tarot Diva is packed with solid tarot knowledge infused with modern magic, power, and fun.""—Ruth Ann and Wald Amberstone, directors of The Tarot School ""A novel and fun approach that results in a greater understanding and interaction with tarot's rich imagery.""—Ciro Marchetti, creator of The Gilded Tarot ""Sasha Graham is intuitive, inventive, and a gifted story teller. She not only tells you how to read the tarot, but also what it feels like to read and why you would want to.""—Robert M. Place, author of The Tarot: History, Symbolism, and Divination"
256,256,https://d1w7fb2mkkr3kw.cloudfront.net/assets/images/book/mid/9780/7434/9780743477550.jpg,Othello,William Shakespeare,Paperback,4.0,6.21,$,,9780743477550,Stationery,dataset/Stationery/0000257.jpg,"In the board game 'Othello', players must turn double-sided counters to their advantage. This doubleness is shared by Shakespeare's play of 1604, marked from its outset by a dual and paradoxical title 'Othello, or the Moor of Venice'. This study teases out instances of doubleness, duplication and paradox to discuss the play's language and its themes. Chapters cover the issues of substitution, of racial polarity and its confusions, of the contested place of the domestic in the play, and the mixed generic signals this comedy-turned-tragedy gives out to its audiences. Throughout the emphasis is on the close readings of the play on the page and on stage, informed by the recent scholarship that has made Othello so pressing a play for the vexed cultural politics of the twenty-first century."
257,257,https://d1w7fb2mkkr3kw.cloudfront.net/assets/images/book/mid/9780/8807/9780880794961.jpg,Universal Waite Tarot Cards,Stuart R Kaplan,Cards,0.0,16.8,$,23.5,9780880794961,Stationery,dataset/Stationery/0000258.jpg,"Discover everything you ever wanted to know about the world's most popular tarot deck. The Ultimate Guide to the Rider Waite Tarot details the ten most important symbols on each and every card in the deck complete with hundreds of illustrations for easy use. In addition to an explanation of the symbols, each card is given a brief interpretation by topic: • Primary meaning • Prognosis or tendency • Spiritual meaning • Love and relationship meaning • Daily meaning • Success and happiness meaning Writing in a convenient format designed for quick reference, European tarot authorities Johannes Fiebig and Evelin Bürger also provide tips, hints, facts, and lore to improve your reading right away. Within these pages, you will find the top ten most important: • Ways of using a single card • Tips and rules for interpretation • Facts about the tarot • Interpretations for each suit • Spread layout techniques"
258,258,https://d1w7fb2mkkr3kw.cloudfront.net/assets/images/book/mid/9780/7232/9780723247623.jpg,A Flower Fairies Postcard Book,Cicely Mary Barker,Paperback,0.0,7.44,$,7.8,9780723247623,Stationery,dataset/Stationery/0000259.jpg,Thirty full-color postcards are printed on sturdy card stock with illustrations of Barker's most popular fairies. Each full-size card is labeled with the name of its fairy and the book it first appeared in. Full-color illustrations. 30 postcards. Consumable.
259,259,https://d1w7fb2mkkr3kw.cloudfront.net/assets/images/book/mid/9780/0601/9780060191443.jpg,Dressing the Man,Alan Flusser,Hardback,4.0,35.72,$,43.7,9780060191443,Stationery,dataset/Stationery/0000260.jpg,"Dressing the Man is the definitive guide to what men need to know in order to dress well and look stylish without becoming fashion victims. Alan Flusser's name is synonymous with taste and style. With his new book, he combines his encyclopedic knowledge of men's clothes with his signature wit and elegance to address the fundamental paradox of modern men's fashion: Why, after men today have spent more money on clothes than in any other period of history, are there fewer well-dressed men than at any time ever before? According to Flusser, dressing well is not all that difficult, the real challenge lies in being able to acquire the right personalized instruction. Dressing well pivots on two pillars -- proportion and color. Flusser believes that ""Permanent Fashionability,"" both his promise and goal for the reader, starts by being accountable to a personal set of physical trademarks and not to any kind of random, seasonally served-up collection of fashion flashes. Unlike fashion, which is obliged to change each season, the face's shape, the neck's height, the shoulder's width, the arm's length, the torso's structure, and the foot's size remain fairly constant over time. Once a man learns how to adapt the fundamentals of permanent fashion to his physique and complexion, he's halfway home. Taking the reader through each major clothing classification step-by-step, this user-friendly guide helps you apply your own specifics to a series of dressing options, from business casual and formalwear to pattern-on-pattern coordination, or how to choose the most flattering clothing silhouette for your body type and shirt collar for your face. A man's physical traits represent his individual road map, and the quickest route toward forging an enduring style of dress is through exposure to the legendary practitioners of this rare masculine art. Flusser has assembled the largest andmost diverse collection of stylishly mantled men ever found in one book. Many never-before-seen vintage photographs from the era of Cary Grant, Tyrone Power, and Fred Astaire are employed to help illustrate the range and diversity of authentic men's fashion. Dressing the Man's sheer magnitude of options will enable the reader to expand both the grammar and verbiage of his permanent-fashion vocabulary. For those men hoping to find sartorial fulfillment somewhere down the road, tethering their journey to the mind-set of permanent fashion will deliver them earlier rather than later in life."
260,260,https://d1w7fb2mkkr3kw.cloudfront.net/assets/images/book/mid/9781/6334/9781633440234.jpg,Star Wars: Imperial Assault IG-88 Villain Pack,Fantasy Flight Games,Game,0.0,10.16,$,,9781633440234,Stationery,dataset/Stationery/0000261.jpg,"Showcases and details the rare, popular, forgotten, and beloved figures coveted by fans the world over."
261,261,https://d1w7fb2mkkr3kw.cloudfront.net/assets/images/book/mid/9781/2501/9781250166517.jpg,One Question a Day for Kids: A Three-Year Journal,Aimee Chase,Hardback,4.5,12.87,$,16.0,9781250166517,Stationery,dataset/Stationery/0000262.jpg,"A fun and clever way for kids to keep track and look back. One Question a Day for Kids is a guided journal with fun and thoughtful questions for each day of the year. By answering the same question every day for three years, children will be able to see how their thoughts, creativity, and even handwriting changes from year to year. Prompts are short and sweet, allowing kids to answer as concisely (or elaborately) as they want. Questions include: If you could have a super power, what would it be? What's the grossest thing you've ever seen? Which of your friends do you trust the most? What's one thing your parents don't know about you? Rate your teachers from favorite to least favorite."
262,262,https://d1w7fb2mkkr3kw.cloudfront.net/assets/images/book/mid/9780/8807/9780880793957.jpg,Cosmic Tarot Deck,Norbert Losche,Cards,4.5,20.3,$,28.0,9780880793957,Stationery,dataset/Stationery/0000263.jpg,"A complete guide to the symbolism and use of Norbert Losche's popular deck. Provides card interpretations on three different levels: the cosmos, the human community, and the individual."
263,263,https://d1w7fb2mkkr3kw.cloudfront.net/assets/images/book/mid/9781/7824/9781782433866.jpg,Ultimate Dot to Dot,Gareth Moore,Paperback,4.5,11.89,$,12.9,9781782433866,Stationery,dataset/Stationery/0000264.jpg,"Containing 30 seriously challenging dot-to-dots and over 30,000 dots, Ultimate Dot-to-Dot will entertain and engage puzzlers for hours on end as each puzzle gradually reveals intricate animals, objects and scenes."
264,264,https://d1w7fb2mkkr3kw.cloudfront.net/assets/images/book/mid/9780/7387/9780738737904.jpg,Tarot Illuminati,Kim Huggens,Boxed Set,4.5,26.86,$,34.0,9780738737904,Stationery,dataset/Stationery/0000265.jpg,This detailed guide provides deeper instruction into the meanings of tarot. Included are hands-on exercises and techniques.
265,265,https://d1w7fb2mkkr3kw.cloudfront.net/assets/images/book/mid/9780/8118/9780811836746.jpg,Living out Loud,Keri Smith,Notebook / blank book,4.0,11.29,$,16.0,9780811836746,Stationery,dataset/Stationery/0000266.jpg,"Living Out Loud: An Introduction to LGBTQ History, Society, and Culture offers students an evidence-based foundation in the interdisciplinary field of LGBTQ Studies. Chapters on history, diversity, dating/relationships, education, sexual health, and globalization reflect current research and thinking in the social sciences, humanities, and sciences. Coverage of current events and recommendations for additional readings, videos, and web resources help students apply the contents in their lives, making Living Out Loud the perfect core text for LGBTQ+ Studies (and similar) courses."
266,266,https://d1w7fb2mkkr3kw.cloudfront.net/assets/images/book/mid/9781/6334/9781633440272.jpg,Star Wars,,Game,0.0,12.2,$,13.99,9781633440272,Stationery,dataset/Stationery/0000267.jpg,"The Force is strong with this collection of comics featuring the entire renowned 6-movie saga plus the Clone Wars, alternate histories, and more. This bin features 58 books, 1 copy of each title. Includes the following series: Star Wars (24 titles), Star Wars: The Clone Wars (12 titles), Star Wars: Knight Errant (5 titles), Star Wars: Darth Vader and the Lost Command (5 titles), and Star Wars: Infinities (12 titles)."
267,267,https://d1w7fb2mkkr3kw.cloudfront.net/assets/images/book/mid/8051/2728/8051272893601.jpg,"Moleskine Classic Notebook, Large, Ruled, Sapphire Blue, Hard Cover (5 X 8.25)",,Diary,0.0,11.51,$,18.01,8051272893601,Stationery,dataset/Stationery/0000268.jpg,
268,268,https://d1w7fb2mkkr3kw.cloudfront.net/assets/images/book/mid/9781/6070/9781607052357.jpg,Ultimate 3-in-1 Color Tool 3rd Edition,Joen Wolfrom,Cards,4.0,15.14,$,22.0,9781607052357,Stationery,dataset/Stationery/0000269.jpg,"Squares and rectangles are not just for beginners! Fabric-lovers—you’ll agree with Amy Walsh and Janine Burke that sewing basic patterns with straight lines is just about the quickest and most satisfying way to get yourself to a finished quilt. Ten quilt projects include yardage and cutting requirements for multiple-sizes. Enjoy stress-free piecing, easy construction, and learn how to alter patterns for completely different looks by resizing the blocks, trying a different setting, or changing the color palette. With fun, no-fuss patterns like these, you’re free to explore all kinds of exciting possibilities with different colors, fabrics, and layouts!"
269,269,https://d1w7fb2mkkr3kw.cloudfront.net/assets/images/book/mid/9788/8629/9788862930024.jpg,Moleskine Pocket Plain Hardcover Notebook Red,Moleskine,Notebook / blank book,0.0,9.59,$,14.9,9788862930024,Stationery,dataset/Stationery/0000270.jpg,
270,270,https://d1w7fb2mkkr3kw.cloudfront.net/assets/images/book/mid/9781/7848/9781784870119.jpg,The Dumb House,John Burnside,Paperback,4.0,8.62,$,11.4,9781784870119,Stationery,dataset/Stationery/0000271.jpg,
271,271,https://d1w7fb2mkkr3kw.cloudfront.net/assets/images/book/mid/9780/5534/9780553448214.jpg,Q&A a Day for Moms,Potter Gift,Diary,4.5,15.5,$,19.0,9780553448214,Stationery,dataset/Stationery/0000272.jpg,
272,272,https://d1w7fb2mkkr3kw.cloudfront.net/assets/images/book/mid/9781/6010/9781601060587.jpg,Knock Knock Insults & Comeback for All Occasions,Knock Knock,Hardback,3.5,6.05,$,7.8,9781601060587,Stationery,dataset/Stationery/0000273.jpg,Knock-knock jokes feature a wide variety of humorous puns.
273,273,https://d1w7fb2mkkr3kw.cloudfront.net/assets/images/book/mid/9788/8837/9788883704970.jpg,Moleskine Plain Cahier L - Black Cover (3 Set),Moleskine,Notebook / blank book,0.0,8.9,$,11.9,9788883704970,Stationery,dataset/Stationery/0000274.jpg,"""A cheeky take on the afterlife brimming with sass, angst, and heart."" --Christine Riccio, New York Times bestselling author of Again, but Better. Beatrice Fox deserves to go straight to hell. At least, that's what she believes. Her last day on Earth, she ruined the life of the person she loves most--her little sister, Emmy. So when Bea awakens from a fatal car accident to find herself on an airplane headed who knows where, she's confused, to say the least. Once on the ground, Bea receives some truly harrowing news: she's in purgatory. If she ever wants to catch a flight to heaven, she'll have to help five thousand souls figure out what's keeping them from moving on. But one of Bea's first assignments is Caleb, the boy who caused her accident, and the last person Bea would ever want to send to the pearly gates. And as much as Bea would love to see Caleb suffer for dooming her to a seemingly endless future of eating bad airport food and listening to other people's problems, she can't help but notice that he's kind of cute, and sort of sweet, and that maybe, despite her best efforts, she's totally falling for him. From debut author Gabby Noone comes a darkly hilarious and heartfelt twist on the afterlife about finding second chances, first loves, and new friendships in the most unlikely places."
274,274,https://d1w7fb2mkkr3kw.cloudfront.net/assets/images/book/mid/9780/7624/9780762409747.jpg,The Mini Bonsai Kit,Robert W. King,Mixed media product,3.0,6.01,$,,9780762409747,Stationery,dataset/Stationery/0000275.jpg,"With this kit, complete with a 32page book explaining bonsai gardening, an instruction sheet, a small pot, a peat pellet, a packet of seeds, and a pair of scissors, indoor gardeners can grow a peaceful mini-garden anywhere they choose. Whether it's on a desk or in a kitchen, this little bit of greenery will brighten up the day-just add water! Also available in a full-size kit"
275,275,https://d1w7fb2mkkr3kw.cloudfront.net/assets/images/book/mid/9780/7624/9780762492275.jpg,Pusheen: A Cross-Stitch Kit,Claire Belton,Paperback,4.5,6.69,$,9.0,9780762492275,Stationery,dataset/Stationery/0000276.jpg,"Craft your very own Pusheen masterpieces with Pusheen: A Cross-Stitch Kit! Pusheen is the Internet's favorite chubby tabby who has warmed the hearts of millions with her animated GIFs and comics. For fans of I Am Pusheen the Cat; Pusheen: A Magnetic Kit; and the Pusheen coloring books, this craft kit includes everything you need to create cute embroidered designs of the lazy, lovable feline: A 32-page mini book with cross-stitching instructions and two easy patterns (perfect for beginners and advanced stitchers alike) Two 5"" x 5"" pieces of cotton Aida cloth A 3-inch embroidery hoop Two tapestry needles Four skeins of embroidery thread"
276,276,https://d1w7fb2mkkr3kw.cloudfront.net/assets/images/book/mid/9780/8118/9780811859080.jpg,Listography Journal,Lisa Nola,Calendar,4.0,11.33,$,13.5,9780811859080,Stationery,dataset/Stationery/0000277.jpg,"A new twist on the bestselling Listography journal series (almost 900,000 titles sold), this game invites players to create and share lists based on fun and thought-provoking topics from geography and pop culture to toothpaste and constellations! With the goal of being the first around the game board, players score points according to the number of similar or unique answers. Every round in the game results in creative thinking, surprise outcomes, and lots of laughs."""
277,277,https://d1w7fb2mkkr3kw.cloudfront.net/assets/images/book/mid/9781/9848/9781984824707.jpg,"Salt, Fat, Acid, Heat",Samin Nosrat,Paperback,4.5,14.95,$,21.5,9781984824707,Stationery,dataset/Stationery/0000278.jpg,"Whether you've never picked up a knife or you're an accomplished chef, there are only four basic factors that determine how good your food will taste. Salt, Fat, Acid, and Heat are the four cardinal directions of cooking, and they will guide you as you choose which ingredients to use and how to cook them, and they will tell you why last minute adjustments will ensure that food tastes exactly as it should. This book will change the way you think about cooking and eating, and help you find your bearings in any kitchen, with any ingredients, while cooking any meal. --"
